Course Names,descriptions,prereq,Breadth requirements,distribution requirements
ESS103H1 - Geology in Public Issues,"Geologic hazards: earthquakes, volcanoes, landslides, tsunamis. The distribution and politics of natural resources, including petroleum and ore deposits. Nuclear power and nuclear waste disposal. Global change: the geologic record of hot and cold climates, and how the earth survives.  ESS103H1 is primarily intended as a science Distribution Requirement course for Humanities and Social Science, it will be taught in odd years.",,The Physical and Mathematical Universes (5),Science
ESS104H1 - Controversies in Earth Science,"The evolution of ideas about the origin and development of the earth from the Athenians to the 20th Century, with attention on the age of earth; on the evolution and disappearance of species; on the origin of oceans, continents and mountains; on climate change; and on the courage of scientists in confronting the religious and political views of their time.  ESS104H1 is primarily intended as a science Distribution Requirement course for Humanities and Social Science students. Taught in even years.",,The Physical and Mathematical Universes (5),Science
ESS105H1 - Our home planet,The nature and evolution of the Earth; plate tectonics; rocks and minerals; volcanism; geological time; fossils; geology of Ontario; environmental issues; and human interactions with the planet.  ESS105H1 is primarily intended as a science Distribution Requirement course for Humanities and Social Science students,,The Physical and Mathematical Universes (5),Science
ESS196H1 - Life and Death in the Solar System,"Earth is the only planet in the solar system known to support life. Through directed readings, seminars, videos and lab visits, participants in this course will work with instructors whose own research tackles important questions concerning the origin of life on earth; the limits to life on this planet; implications for life under extreme conditions elsewhere in the solar system; and the life cycles of the planets themselves. The course will involve reading of scientific literature, student-led discussions, oral presentations and research projects, as well as potential field trips to sites in Southern Ontario. Restricted to first-year students. Not eligible for CR/NCR option.",,The Physical and Mathematical Universes (5),Science
ESS197H1 - Earth and Life through Time,"This seminar will look through the lens of earth history to explore drivers of change in the biosphere and the impacts of these changes. We will focus on episodes of mass extinction, and the spectacular landscape changes and speciation events which often followed. Abrupt or gradual climatic changes, massive volcanism, asteroid impacts, catastrophic carbon releases, and human activity will be evaluated as the causes of major extinction events in Earth history. The course will involve reading of scientific literature, student-led discussions, oral presentations and research projects, as well as potential field trips to sites in Southern Ontario. Restricted to first-year students. Not eligible for CR/NCR option.",,The Physical and Mathematical Universes (5),Science
ESS198H1 - Resources and Sustainability,"The rise of humanity is intricately linked to the exploitation of natural resources. From its earliest attempts to use fire and extract metals from rocks, to coal-fired steam that brought the industrial revolution, hydrocarbons that fuel international travel and trade, nuclear energy to produce electricity, and the reliance on smartphones in our daily lives, the planet’s resources have brought innovation and problems and require us to ask questions regarding sustainability. This course will explore the gamut from resource extraction and trading, to its societal consequences including global politics, environmental pollution, and remediation. The course will involve reading of scientific literature, student-led discussions, oral presentations and research projects, and potentially field trips to sites in Southern Ontario. Restricted to first-year students. Not eligible for CR/NCR option.",,The Physical and Mathematical Universes (5),Science
"ESS199H1 - Earth, Portrait of a Planet","Modern Earth Sciences touches on virtually all aspects of modern life, from the atmosphere to large scale natural disasters. This course will explore how earth sciences has shaped our society and our understanding of the earth as a system. Potential course topics will vary depending on the instructor, and include (but are not limited to) the great climate change crisis and what we know about climate change in the past to the literally earth moving ideas of plate tectonics (and the associated natural disasters). The course will involve reading of scientific literature, student-led discussions, oral presentations and research projects. Restricted to first-year students. Not eligible for CR/NCR option.For further information, please contact the Student Affairs Coordinator (Scott Moore, Department of Earth Sciences, 22 Russell St. Earth Sciences Center, Room 1062 email: ugrad@es.utoronto.ca).",,The Physical and Mathematical Universes (5),Science
ESS205H1 - Confronting Global Change,"The emergence of society as a major geological force is considered in terms of the evolving debate about the consequences of human activity for the habitability of our planet. Major issues such as climate change, environmental pollution, and depletion of natural resources are examined.",Completion of at least 4.0 credits,Living Things and Their Environment (4),Science
ESS223H1 - Earth System Chemistry 1: Earth Materials,"This course introduces students to the basic principles of geochemistry beginning with some fundamental chemical concepts concerning atoms, bonding and the periodic table. It continues with an overview of the wide ranging geochemical fields and concepts such as elemental distributions, fractionation and differentiation, and trace element cycling. The latter half of the courses leads into an introduction to basic thermodynamics as it applies to more advanced geochemical concepts found in aqueous geochemistry, mineralogy and petrology.","MAT135H1, MAT136H1, CHM135H1",The Physical and Mathematical Universes (5),Science
ESS224H1 - Introduction to Mineralogy and Petrology,"An introduction to atomic structure, chemistry, physical properties, and geological significance of rock-forming minerals and rocks. Field techniques and core concepts to identify important minerals and rocks in hand specimens and place them into their geological context. The development of practical skills is emphasized.",JEG100H1/ESS262H1,The Physical and Mathematical Universes (5),Science
ESS234H1 - Introduction to Geological Field Methods,"A two-week field course in early May or late August. Students are introduced to field geology and to basic field measurement, mapping and documentation techniques (for example in the Espanola - Manitoulin Island area, west of Sudbury). Students are responsible for the cost of board and lodging and transport to and from the field area. Not eligible for CR/NCR option. Note: Enrollment is handled by the department. For registration deadlines, additional fees associated with the field course, course dates, and special registration requirements, please consult the departmental announcements or inquire with ugrad@es.utoronto.ca.","ESS224H1/ESS222H1, ESS241H1, ESS262H1/JEG100H1",The Physical and Mathematical Universes (5),Science
ESS241H1 - Geologic Structures and Maps,"Field observations, description and classification of geological structures: stratigraphic and intrusive contacts, unconformities; relative age determination; folds and fold systems; faults and fault systems; boudinage, foliations and lineations; spherical projections and mechanical principles (stress, strain, rheology). Practical work focuses on reading geological maps, constructing cross-sections, and interpreting both in terms of geological processes and histories.",,The Physical and Mathematical Universes (5),Science
ESS245H1 - Computational Geology,"A practical introduction to programming. This course will teach an operational knowledge on how to write and execute self written computer programs. Course topics touch upon using a computer without a graphical interface, using an integrated development environment, programming, documenting, debugging, reading and writing data, graphical output, how to navigate existing documentation and internet resources, and last but not least how to effectively ask for help. Students will work individually and in small groups in an inverted classroom setting on earth science related problem sets. Previous programming experience is not required.","1.0 credit from first-year math, or physics courses except MAT193H1, MAT198H1, MAT199H1, PHY196H1, PHY197H1, PHY198H1, PHY199H1",The Physical and Mathematical Universes (5),Science
ESS261H1 - Earth System Evolution,"Interrelationships between Earths atmosphere, hydrosphere, geosphere and biosphere through time; including patterns of evolution and extinction as they are related to changes at the earth's surface and recorded in the rock record. Laboratories cover major groups of fossils, their classification, use in biostratigraphy, and living analogues. NOTE: ESS261H1 and ESS262H1 may be taken in either order; and both are required for advanced courses.",,The Physical and Mathematical Universes (5),Science
ESS262H1 - Earth System Processes,"An introduction to how our planet works, focusing on physical processes that govern the nature and composition of Earth with an emphasis on the dynamic nature of the planet. Topics include surface processes (e.g., weathering and erosion, ocean and atmospheric circulation, weather and climate), crustal processes (e.g., plate tectonics, earthquakes, volcanoes, biogeochemical cycles), and earth-environment interactions (e.g., natural hazards, resource development, and sustainability).",,The Physical and Mathematical Universes (5),Science
ESS299Y1 - Research Opportunity Program,Credit course for supervised participation in faculty research project. Details at https://www.artsci.utoronto.ca/current/academics/research-opportunities/research-opportunities-program. Not eligible for CR/NCR option.,,,Science
ESS311H1 - Earth System Chemistry 2: Aqueous Geochemistry,"An introduction to aqueous environmental geochemistry emphasising the importance of chemical equilibria, mass transport, and microbiological activity in regulating the chemical composition of natural and contaminated systems.",ESS223H1/ENV233H1,The Physical and Mathematical Universes (5),Science
ESS312H1 - Hydrogeology,"Groundwater flow, the role of groundwater in geologic processes, and physical, chemical and biological constraints on contaminant source transport and attenuation.",ESS311H1,The Physical and Mathematical Universes (5),Science
ESS321H1 - Mineralogy,"Systematic mineralogy (including identification, classification, and description); physical and chemical properties of minerals; crystallography and crystal systems (symmetry, crystal structure, crystal systems); optical techniques in mineral identification.","ESS224H1, ESS234H1",The Physical and Mathematical Universes (5),Science
ESS322H1 - Igneous Petrology,"An overview of the nature and origin of igneous rocks, with particular emphasis on the interpretation of textures and mineral assemblages as they reflect rock-forming processes. Topics include the physical and chemical properties of magma, origin, and evolution of different magmatic series in specific igneous/tectonic environments, geochemical and isotopic characteristics of igneous rocks, and the assimilation, fractionation & crystallization processes.","ESS224H1, ESS234H1, ESS321H1/ESS221H1",The Physical and Mathematical Universes (5),Science
ESS323H1 - Metamorphic Petrology,"This course provides a basic understanding of the formative processes of metamorphic rocks through quantitative applications of simple thermodynamic and kinetic principles. Topics include processes of heat and mass transport in orogenic belts, fluid-rock interaction in metasomatic systems, pressure-temperature-time paths of metamorphic rocks, temporospatial patterns of metamorphism through geologic time, and metamorphism in extreme conditions.","ESS222H1/ESS224H1, ESS234H1, ESS221H1/ESS321H1",The Physical and Mathematical Universes (5),Science
ESS324H1 - Advanced Geological Field Methods,"A two-week advanced geological mapping project in a challenging field environment. Students learn to compile existing geoscience data, create a geological map and prepare a professional final report on their activities and findings. Not eligible for CR/NCR option. For registration deadlines, additional fees associated with the field course, course dates, and special registration requirements, please consult the departmental announcements or inquire with ugrad@es.utoronto.ca.","ESS322H1, ESS234H1/ESS330H1",The Physical and Mathematical Universes (5),Science
ESS331H1 - Sedimentation and Stratigraphy,"Formal principles of stratigraphy, types of stratigraphic unit, methods of dating and correlation (biostratigraphic methods, magnetostratigraphy, radiometric dating). Methods of study in surface and subsurface (outcrop measurement, elementary introduction to wireline logs, seismic methods). The principles of facies analysis; sediment transport - sedimentary structures, the flow regime, and sediment gravity flows. The carbonate factory and carbonate rock classification. Trace fossils. Laboratory exercises in understanding facies mapping, isopachs and isolith maps.",ESS224H1,The Physical and Mathematical Universes (5),Science
ESS361H1 - Atmosphere-Biosphere Interact,"Theory on the exchange of energy and matter (carbon, water) between the land surface and atmosphere, with a focus on the implications of ecosystem-level processes for regional micrometeorology. Examples will be taken from research on contemporary as well as palaeoclimate systems. Case studies to include how changes in vegetation type alter surface radiation balance, hydrological cycling and heat transfer in soils. There is no formal textbook for this course. Lecture material will be augmented with assigned readings from the scientific literature.",8.0 credits including 1.0 credit from: PHY131H1/PHY132H1/CHM135H1/CHM136H1/MAT135H1/MAT136H1,Living Things and Their Environment (4),Science
ESS362H1 - Oceanography,"An introduction to the physical, geological, chemical, and biological processes governing the world’s oceans. The course emphasizes critical thinking, environmental issues, and interrelationships among scientific disciplines.",Completion of 8.0 credits,The Physical and Mathematical Universes (5),Science
ESS381H1 - Special Topics in Earth Science,"A survey of current thinking in Earth science. Topics may include isotope geochemistry, ore genesis, or planetary remote sensing.",minimum of 1.0 credits in ESS at the 200+level,The Physical and Mathematical Universes (5),Science
ESS391H1 - Directed Studies,"An individual study program chosen by the student with the advice, and under the supervision, of a faculty member. Such work may involve obtaining data in the field or lab and analyzing it, an interdisciplinary research project, and supervised readings. Not eligible for CR/NCR option.","Enrolment in an Earth Science program of study, completion of at least 1.0 credit of 200-level ESS courses.",,Science
ESS392Y1 - Directed Studies,"An individual study program chosen by the student with the advice, and under the supervision, of a faculty member. Such work may involve obtaining data in the field or lab and analyzing it, an interdisciplinary research project, and supervised readings. Not eligible for CR/NCR option.",Enrolment in an Earth Sciences Program of Study; completion of at least 1.0 credit of 200-level ESS courses.,,Science
ESS398H0 - Research Excursions,An instructor-supervised group project in an off-campus setting. Details at https://www.artsci.utoronto.ca/current/academics/research-opportunities/research-excursions-program. Not eligible for CR/NCR option.,,,Science
ESS398Y0 - Research Excursions,An instructor-supervised group project in an off-campus setting. Details at https://www.artsci.utoronto.ca/current/academics/research-opportunities/research-excursions-program. Not eligible for CR/NCR option.,,,Science
ESS410H1 - Field Techniques in Hydrogeochemistry,"A ten-day field course in late summer at the Deep River field site designed to familiarize students in a variety of hydrogeological and biogeochemical field techniques; includes a mixture of lecture, laboratory and field exercises. Not eligible for CR/NCR option. Note: Enrollment is handled by the department. For registration deadlines, additional fees associated with the field course, course dates, and special registration requirements, please consult the departmental announcements or inquire with ugrad@es.utoronto.ca. Additional fee of up to $500 will apply.","ESS311H1, ESS312H1",The Physical and Mathematical Universes (5),Science
ESS423H1 - Mineral Deposits,"Geology and geochemistry of ore deposits. Origin and interpretation; systematic ore mineralogy, in hand specimen and reflected light microscopy.","ESS322H1, ESS323H1",The Physical and Mathematical Universes (5),Science
ESS425H1 - Advanced Methods in the Geosciences,"This course provides an in-depth exploration of methods which are commonly used in the Geosciences. The course content will vary from year to year; students should inquire with the Department about course topics and pre-requisites before the beginning of the Fall term. Topics taught in this course include, but are not limited to, laboratory analytical techniques (such as X-ray diffraction, X-ray fluorescence, stable isotopes, light and scanning electron microscopy and Inductively Coupled Plasma Mass Spectrometry), core logging, computational techniques including modeling, statistical methods, or spatial analysis tools for geological mapping applications such as plotting cross sections or correlating biostratigraphies.",8.0 ESS credits,The Physical and Mathematical Universes (5),Science
ESS431H1 - Basin Analysis,"Detailed study of each of the major sedimentary environments. Typical facies assemblages, cyclic sedimentation. Autogenic and allogenic processes. The principles of sequence stratigraphy. The history of the sequence concept; systems tracts and bounding surfaces. Sequence models. What causes sequences: mechanisms of change in base level and accommodation: – tectonism, climate change, eustatic sea-level change.",ESS331H1,The Physical and Mathematical Universes (5),Science
ESS441H1 - Advanced Structural Geology,"Principles of geological mechanics: stress, strain, rheology. Faulting, folding and development of tectonic foliations and lineations. Structural analysis of fractures, folds and tectonites.","8.0 ESS credits including: ESS322H1, ESS234H1, ESS241H1, ESS331H1",The Physical and Mathematical Universes (5),Science
ESS445H1 - Global Tectonics,Exploration of physical Earth processes and their relationship to large-scale geological phenomena. Mantle convection as plate tectonic engine; intraplate/plate boundary lithospheric deformation including orogenesis and crustal subsidence. Focus on reconciling geodynamic theory/modelling with geological/geophysical observations.,,The Physical and Mathematical Universes (5),Science
ESS450H1 - Geophysical Field Techniques,"A ten-day field course in late August at the Deep River field site. Students get hands-on experience using geophysical instrumentation, applying various data collection techniques, and performing data analysis in gravity, magnetic, seismic, electrical, electromagnetic, and radar surveys. Not eligible for CR/NCR option. Note: Enrollment is handled by the department. For registration deadlines, additional fees associated with the field course, course dates, and special registration requirements, please consult the departmental announcements or inquire with ugrad@es.utoronto.ca. Additional fee of up to $500 will apply.",,The Physical and Mathematical Universes (5),Science
ESS452H1 - Geophysical Imaging with Non-seismic Methods,"Current geophysical surface and borehole methodologies (gravity, magnetics, electrical, electromagnetic, nuclear) and their theoretical basis for investigating Earth's interior to depths ranging from several metres to tens of kilometers.",,The Physical and Mathematical Universes (5),Science
ESS461H1 - Palaeoenvironmental Studies,"The use of proxy data (terrestrial and aquatic microfossils) to infer past environmental conditions. The nature and extent of Quaternary environmental change is considered in the context of assessing current issues such as acidification, metal pollution, eutrophication and global climate change. Paleoenvironmental techniques are applied in the laboratory.",ESS261H1,Living Things and Their Environment (4),Science
ESS462H1 - Global Biogeochemical Cycles,"A seminar course focusing on the exchange of matter (i.e. elements, minerals) between the Earth’s atmosphere, ocean, and biosphere. Course-related topics include global biogeochemical cycling of carbon, nitrogen, phosphorous, silicon, iron, and zinc (amongst other elements) and will include both terrestrial and marine ecosystems. Examples and case studies will be viewed from the paleo-, contemporary and potential future global change perspectives. The overall content of course readings will be determined by student interest, as students have the freedom to choose topics (readings) of personal interest. Offered in alternate years.","10.0 credits from any of ESS/MAT/PHY/CHM/EEB/GGR, including  ESS361H1/ ESS362H1/ GGR305H1",The Physical and Mathematical Universes (5),Science
ESS464H1 - Biological Perspectives on Earth System Evolution,"A seminar course focussing on ways that the Earth's biosphere (terrestrial and marine) has altered the overall functioning of the Earth System over geological time, including (1) influence of terrestrial vegetation on surface processes such as palaeosol development, river geomorphology, erosion, and cycling of major biogeochemical nutrients on land, (2) influence of the marine biosphere on the concentration of O2 and CO2 in the atmosphere, including the origin of the stratospheric ozone layer, and (3) the interactive influence of the terrestrial and marine biosphere on atmospheric moisture transport, production of latent relative to sensible heat fluxes, and the development of the planetary boundary layer. Offered in alternate years.","ESS261H1/ESS262H1, ESS361H1/ESS362H1/GGR305H1 or permission of the instructor",Living Things and Their Environment (4),Science
ESS481H1 - Advanced Topics in Earth Sciences,"This course is offered on an irregular basis, typically in the winter term. Students are advised to consult the departmental notices with respect to course times and content, but should expect an in-depth study of modern earth science questions, for example mineralogy and material science, advanced petrology, or exploration geochemistry. Course instructors will often, but not always, be recruited from Industry.",appropriate 300-level ESS credits. Prerequisites change from year to year; consult Department for details.,The Physical and Mathematical Universes (5),Science
ESS490H1 - Geological Capstone Fieldtrip,"A two-week excursion to a challenging field setting. Students will integrate field observations with their accumulated knowledge of geodynamics, structural geology, and landscape evolution to understand large-scale geological events. Not eligible for CR/NCR option. This course can be offered in any given term. Note: Enrolment is handled by the department. For registration deadlines, additional fees associated with the field course, course dates, and special registration requirements, please consult the departmental announcements or inquire with ugrad@es.utoronto.ca. Additional fee of up to $900 may apply.",12.0 credits from any Earth Science program of study requirements. Students who do not meet the prerequisite are encouraged to contact the instructor.,The Physical and Mathematical Universes (5),Science
ESS491H1 - Undergraduate Thesis Project,"Research emphasising methods used in field and experimental work. Students must obtain the consent of an instructor and register with the undergraduate coordinator and are urged to do so toward the end of their third year. In addition to submitting a thesis, students are required to give an oral presentation of their research results to an open meeting of the department. Not eligible for CR/NCR option.","Completion of the required 300-level courses, and enrollment in a relevant program and permission of the department.",The Physical and Mathematical Universes (5),Science
ESS492Y1 - Undergraduate Thesis Project,"Research emphasising methods used in field and experimental work. Students must obtain the consent of an instructor and register with the undergraduate coordinator and are urged to do so toward the end of their third year. In addition to submitting a thesis, students are required to give an oral presentation of their research results to an open meeting of the department. Not eligible for CR/NCR option.",Completion of the required 300-level courses in an appropriate program and permission of the department.,The Physical and Mathematical Universes (5),Science
