Course Names,descriptions,prereq,Column 4,Breadth requirements,distribution requirements
ECO351H1 - Special Topics in Economics,Courses may be offered in one or more subjects each year. Students must meet the prerequisites announced by the Department (see the Undergraduate Administrator or the Economics Department website for details).,TBA,,Society and its Institutions (3),Social Science
ECO352H1 - Special Topics in Economics,Courses may be offered in one or more subjects each year. Students must meet the prerequisites announced by the Department.,See the Department of Economics website for details.,,Society and its Institutions (3),Social Science
ECO356H1 - Special Topics in Financial Economics,Courses may be offered in one or more subjects each year. Students must meet the prerequisites announced by the Department.,See the Department of Economics website for details.,,Society and its Institutions (3),Social Science
ECO358H1 - Financial Economics I,"An introduction to economics of financial assets and financial markets. Topics: inter-temporal choice, expected utility theory, security valuation, selected asset pricing models, market efficiency, and the term structure of interest rates - essential materials for an understanding of the role and operation of financial markets.","ECO200Y1/ECO204Y1/ECO206Y1; ECO220Y1/ ECO227Y1/ (STA237H1, STA238H1)/ (STA247H1, STA248H1)/ (STA257H1, STA261H1)",,Society and its Institutions (3),Social Science
ECO359H1 - Financial Economics II: Corporate Finance,Agency and incomplete information problems inherent in financial transactions; the role of contractual arrangements in overcoming them. Financial constraints on investment decisions of firms; the financial system in economic growth; the legal system in the functioning of financial markets. A look at theoretical and empirical literature covering these issues.,ECO358H1,,Society and its Institutions (3),Social Science
ECO362H1 - Economic Growth,"The course considers a broad range of issues that underlie economic growth, including technical progress and the accumulation of human and physical capital. Beyond these factors, the course also investigates the efficiency with which capital is used, the role of foreign trade, and the possible roles of institutions and geography.","ECO200Y1/ECO204Y1/ECO206Y1; ECO202Y1/ECO208Y1/ECO209Y1; ECO220Y1/ ECO227Y1/ (STA237H1, STA238H1)/ (STA247H1, STA248H1)/ (STA257H1, STA261H1)",,Society and its Institutions (3),Social Science
ECO364H1 - International Trade Theory,"An examination of the causes and consequences of international trade. The first half develops traditional models of comparative advantage. The second half examines more recent theoretical and empirical work on trade & wages, the political economy of trade, outsourcing, and firm heterogeneity.","ECO200Y1/ECO204Y1/ECO206Y1; ECO220Y1/ ECO227Y1/ (STA237H1, STA238H1)/ (STA247H1, STA248H1)/ (STA257H1, STA261H1)",,Society and its Institutions (3),Social Science
ECO365H1 - International Monetary Economics,"Introduction to open economy macroeconomics and international finance. The core objective of the course is to develop macroeconomic models of open economies that can be applied towards gaining an understanding of recent events such as US deficits, financial crises, China's exchange rate policy and the Euro.",ECO202Y1/ECO208Y1/ECO209Y1,,Society and its Institutions (3),Social Science
ECO367H1 - The Economics of Inequality,"This course critically analyzes the causes and recent dynamics of economic inequality both between countries as well as within a particular country, with a particular emphasis on the role of public policy. Theoretical models and empirical approaches are employed, with a focus on the critical assessment of empirical evidence. Topics may include the role of traditional market forces (e.g., globalisation, technological change), the role of institutions (e.g., minimum wage, unions) as well as the role of race and gender.","ECO200Y1/​ECO204Y1/​ECO206Y1, ECO220Y1/​ ECO227Y1/​ (STA237H1, STA238H1)/ (STA247H1, STA248H1)/ (STA257H1, STA261H1)",,Society and its Institutions (3),Social Science
ECO368H1 - Economics of Conflict,"This course explores the links between violent conflict and socioeconomic development. It focuses on micro-level processes leading to conflict, and how conflict and political violence affect people's lives at the household and community levels. It also examines how these processes are linked to wider political and economic issues including governance and the role of institutions. Tools from economic theory are applied alongside country-specific and cross-country empirical evidence.","ECO200Y1/ECO204Y1/ECO206Y1; ECO220Y1/ ECO227Y1/ (STA237H1, STA238H1)/ (STA247H1, STA248H1)/ (STA257H1, STA261H1). Note: Students with ECO100Y1(67%)/(ECO101H1(63%), ECO102H1(63%))/ECO105Y1(80%), plus a full-year of quantitative methods/statistics (e.g., POL222H1, POL232H1), and who are enrolled in the International Relations or Peace, Conflict and Justice Major or Specialist programs may take this course with Permission of the Instructor.",,Society and its Institutions (3),Social Science
ECO369H1 - Health Economics,"The provision of health care provides many special problems of informational asymmetry, regulation, insurance and redistribution. A consideration of the demand and supply side problems. Alternative reform proposals for health care are explored.","ECO200Y1/ECO204Y1/ECO206Y1; ECO220Y1/ ECO227Y1/ (STA237H1, STA238H1)/ (STA247H1, STA248H1)/ (STA257H1, STA261H1)",,Society and its Institutions (3),Social Science
ECO372H1 - Data Analysis and Applied Econometrics in Practice,"How multiple regression can be used to answer causal questions. Implications of, and how to interpret different model specifications and identification strategies. Students will read, critically evaluate and replicate existing research, and conduct their own original analyses. Statistical software STATA or R will be used.","ECO200Y1/ECO204Y1/ECO206Y1; ECO220Y1/ ECO227Y1/ (STA237H1, STA238H1)/ (STA247H1, STA248H1)/ (STA257H1, STA261H1)",,Society and its Institutions (3),Social Science
ECO374H1 - Forecasting and Time Series Econometrics,"An introduction to econometrics similar to ECO375H1, with greater focus on applications drawn from business and financial economics. The course is built around the statistical foundations and economic applications of the multiple regression model. Using statistical software, students will also learn how to conduct, present, and critique empirical research.","ECO200Y1/ECO204Y1/ECO206Y1; ECO220Y1(70%)/ ECO227Y1/ (STA237H1(70%), STA238H1(70%))/ (STA247H1(70%), STA248H1(70%))/ (STA257H1, STA261H1)",,Society and its Institutions (3),Social Science
ECO375H1 - Applied Econometrics I,"Introduction to econometrics. Statistical foundations and the interpretation of multiple regression models, with an emphasis on cross-sectional data. Application of regressions to a wide variety of economic questions and data sources, including the use of statistical software. Problems in the identification of causality, and an introduction to methods of addressing common statistical issues.","ECO200Y1/ECO204Y1/ECO206Y1; ECO220Y1(70%)/ ECO227Y1/ (STA237H1(70%), STA238H1(70%))/ (STA247H1(70%), STA248H1(70%))/ (STA257H1, STA261H1)",,Society and its Institutions (3),Social Science
"ECO380H1 - Markets, Competition, and Strategy","This course in applied microeconomics is concerned with the functioning of markets and the behaviour of firms within these markets. The focus is on strategic relationships between organizations, including competitive relationships among firms in the same market and cooperative relationships between a firm and its suppliers and distributors.","ECO200Y1/ECO204Y1/ECO206Y1; ECO220Y1/ ECO227Y1/ (STA237H1, STA238H1)/ (STA247H1, STA248H1)/ (STA257H1, STA261H1)",,Society and its Institutions (3),Social Science
ECO381H1 - Personnel Economics,"An examination of selected material on compensation and incentives in organizations. Topics include: recruitment and hiring, training, turnover, downsizing, motivating workers, teams, allocating authority and task assignment.","ECO200Y1/ECO204Y1/ECO206Y1; ECO220Y1/ ECO227Y1/ (STA237H1, STA238H1)/ (STA247H1, STA248H1)/ (STA257H1, STA261H1)",,Society and its Institutions (3),Social Science
ECO398H0 - Research Excursions,An instructor-supervised group project in an off-campus setting. Details at https://www.artsci.utoronto.ca/current/academics/research-opportunities/research-excursions-program. Not eligible for CR/NCR option.,,,,Social Science
ECO398Y0 - Research Excursions,An instructor-supervised group project in an off-campus setting. Details at https://www.artsci.utoronto.ca/current/academics/research-opportunities/research-excursions-program. Not eligible for CR/NCR option.,,,,Social Science
ECO399Y1 - Research Opportunity Program,Credit course for supervised participation in faculty research project. Details at https://www.artsci.utoronto.ca/current/academics/research-opportunities/research-opportunities-program. Not eligible for CR/NCR option.,,,,
ECO401H1 - Topics in Economic Policy,"This course covers basic issues in the theoretical and empirical evaluation of public policy. Sample topics include: income redistribution through taxation and the provision of social insurance and public goods, the mitigation of externalities, and welfare analysis in behavioural models.","ECO200Y1/ECO204Y1/ECO206Y1, ECO202Y1/ECO208Y1/ECO209Y1, ECO220Y1/ ECO227Y1/ (STA237H1, STA238H1)/ (STA247H1, STA248H1)/ (STA257H1, STA261H1), at least 1.0 credit in ECO at the 300+ level.",,Society and its Institutions (3),Social Science
ECO402H1 - Topics in Health Economics,"This course explores a variety of topics in health economics, providing students with an overview of current and historical institutional characteristics of the market for, and public policy towards, health care. Students will apply theoretical and empirical tools to current domestic and international issues in health policy. No previous background in health economics is required.","ECO200Y1/ECO204Y1/ECO206Y1, ECO202Y1/ECO208Y1/ECO209Y1, ECO220Y1/ ECO227Y1/ (STA237H1, STA238H1)/ (STA247H1, STA248H1)/ (STA257H1, STA261H1), at least 1.0 credit in ECO at the 300+ level.",,Society and its Institutions (3),Social Science
ECO403H1 - Topics in Development Economics and Policy,"This course covers a variety of topics pertaining to economic development and associated policies. Depending on the course instructor, the focus may be on theories and policies related to poverty alleviation, human capital formation, financial markets, international trade, governance or economic growth.","ECO200Y1/ECO204Y1/ECO206Y1, ECO202Y1/ECO208Y1/ECO209Y1, ECO220Y1/ ECO227Y1/ (STA237H1, STA238H1)/ (STA247H1, STA248H1)/ (STA257H1, STA261H1), at least 1.0 credit in ECO at the 300+ level.",,Society and its Institutions (3),Social Science
ECO404H1 - Topics in Managerial Economics,"Applies quantitative economic methods to real world business-oriented cases. Sample topics include: new product design, decision making under uncertainty, market segmentation and price discrimination, inventory analysis, game theoretic analysis of price wars, financial portfolio design, and optimal pricing. Involves substantial modeling in Excel, regression analysis, optimization methods, and financial reports.","ECO200Y1(75%)/ECO204Y1/ECO206Y1, ECO372H1/ECO374H1/ECO375H1, at least 1.0 credit in ECO at the 300+ level.",,Society and its Institutions (3),Social Science
ECO406H1 - Developmental Macroeconomics,"This course studies a growth model applicable to both middle-income developing countries and resource-rich developed countries. Special attention is paid to causes of cyclical currency overvaluation, particularly Dutch disease and excessive capital inflows.","ECO200Y1/ECO204Y1/ECO206Y1, ECO202Y1/ECO208Y1/ECO209Y1, ECO220Y1/ ECO227Y1/ (STA237H1, STA238H1)/ (STA247H1, STA248H1)/ (STA257H1, STA261H1), at least 1.0 credit in ECO at the 300+ level.",,Society and its Institutions (3),Social Science
ECO407H1 - Competing Views in Macroeconomic Theory and Policy,"Provides students with a systematic analysis of competing perspectives on key areas of macroeconomic theory and policy. Special attention paid to competing views regarding key fiscal, monetary, and trade policy issues as applied to Canada.","ECO200Y1/ECO204Y1/ECO206Y1, ECO202Y1/ECO208Y1/ECO209Y1, ECO220Y1/ ECO227Y1/ (STA237H1, STA238H1)/ (STA247H1, STA248H1)/ (STA257H1, STA261H1), at least 1.0 credit in ECO at the 300+ level.",,Society and its Institutions (3),Social Science
"ECO409H1 - Topics in Money, Banking, and Finance",This course examines the foundations of money and financial institutions using tools mastered in micro and macroeconomics. The goal is a set of principles valid for the analysis of monetary policy and institutional regulation in a variety of real world settings.,"ECO200Y1/ECO204Y1/ECO206Y1, ECO202Y1/ECO208Y1/ECO209Y1, ECO220Y1/ ECO227Y1/ (STA237H1, STA238H1)/ (STA247H1, STA248H1)/ (STA257H1, STA261H1), at least 1.0 credit in ECO at the 300+ level.",,Society and its Institutions (3),Social Science
ECO410H1 - Mergers and Competition Policy,"A combined theoretical, empirical and policy approach to mergers amongst competitors (horizontal mergers). Uses microeconomic models including game theory and econometrics. Delves into recent/current matters assessed by antitrust authorities domestically and/or internationally with applications to specific industries.","ECO372H1/ECO374H1/ECO375H1, at least 1.0 credit in ECO at the 300+ level.",,Society and its Institutions (3),Social Science
ECO414H1 - Energy and Regulation,"This course provides a general treatment of the economics of energy markets and the use of regulation in addressing environmental and other issues arising in these markets. A central theme is the search for an appropriate balance between market forces and regulatory/government intervention. Familiarity with tools of microeconomics and statistics/econometrics is essential. Topics include: oil, natural gas, coal and electricity markets, global warming and other externalities, networks, feed-in-tariffs, carbon taxes, ‘cap-and-trade’ and incentive regulation.","ECO200Y1/ECO204Y1/ECO206Y1; ECO220Y1/ ECO227Y1/ (STA237H1, STA238H1)/ (STA247H1, STA248H1)/ (STA257H1, STA261H1)",,Society and its Institutions (3),Social Science
ECO416H1 - Macroeconometric Models for Policy Analysis and Forecasting,The construction and operation of macroeconometric models. The use of models for conducting policy simulations and for generating quantitative forecasts of economic activity.,"ECO325H1, ECO374H1/ECO375H1",,Society and its Institutions (3),Social Science
ECO417H1 - Economic Development Policy: Community Engaged Learning,"An examination of the causes and consequence of poverty in developing countries with a microeconomic focus, and how it relates it to poverty in the developed world, using a 30-hour service placement at a community organization. Importance of community and context specific factors in policy implementation; learn how local organizations have responded. Use of reflection assignments, papers, group work and class discussions to relate to course concepts. Topics include: poverty traps, health, education, and credit. An application to the instructor is necessary. Not eligible for CR/NCR option.","ECO200Y1/ECO204Y1/ECO206Y1; ECO202Y1/ECO208Y1/ECO209Y1; ECO220Y1/ ECO227Y1/ (STA237H1, STA238H1)/ (STA247H1, STA248H1)/ (STA257H1, STA261H1)",,Society and its Institutions (3),Social Science
ECO418H1 - Empirical Applications of Economic Theory,"Topics class in applied econometrics, emphasizing empirical industrial organization. Emphasis on a balanced treatment of theory and econometric techniques used in empirical research in industrial organization (the study of firms and markets). How firms behave, how market equilibriums arise and how economic policies are used to affect market equilibriums.",ECO374H1/ECO375H1,,Society and its Institutions (3),Social Science
ECO419H1 - International Macroeconomics,"This course studies the causes and consequences of international borrowing and lending and exchange rate fluctuations. We will discuss key empirical facts about these phenomena, develop economic models to understand the forces that drive them, and apply the models to gain insights about a variety of historical contexts like China's rapid economic development and the recent sovereign debt crises in the Eurozone periphery.","ECO200Y1/ECO204Y1/ECO206Y1; ECO202Y1/ECO208Y1/ECO209Y1; ECO220Y1/ ECO227Y1/ (STA237H1, STA238H1)/ (STA247H1, STA248H1)/ (STA257H1, STA261H1)",,Society and its Institutions (3),Social Science
ECO420Y1 - Special Topics in Economics,Seminars or workshops may be offered in one or more subjects each year. Students must meet the prerequisites announced by the Department.,See the Department of Economics website for details.,,Society and its Institutions (3),Social Science
ECO421H1 - Special Topics in Economics,Seminars or workshops may be offered in one or more subjects each year. Students must meet the prerequisites announced by the Department.,See the Department of Economics website for details.,,Society and its Institutions (3),Social Science
ECO422H1 - Special Topics in Economics,Seminars or workshops may be offered in one or more subjects each year. Students must meet the prerequisites announced by the Department.,See the Department of Economics website for details.,,Society and its Institutions (3),Social Science
ECO423H1 - Economics and Biosocial Data,"This course introduces and critically assesses economic research that uses genetic, neuroscientific, and other biosocial data. We will address questions such as: what are the effects of brain neurochemistry on economic decision-making? What role do nature and nurture play in economic behaviour and outcomes? What can we learn from genoeconomics? What are the policy implications (or lack thereof) of related findings? No previous background in biology or genetics is required.","ECO200Y1/ECO204Y1/ECO206Y1, ECO220Y1/ ECO227Y1/ (STA237H1, STA238H1)/ (STA247H1, STA248H1)/ (STA257H1, STA261H1), at least 1.0 credit in ECO at the 300+ level.",,Society and its Institutions (3),Social Science
ECO425H1 - Business Cycles,"This course builds on material covered in ECO208Y1. Students will learn how to use business cycle models to better understand key empirical features of the macroeconomy. Topics covered include: the financial crisis, monetary policy, fiscal policy, theories of unemployment, and the effects of innovation on economic fluctuations, the Great Depression and the Financial Crisis.","ECO200Y1/ECO204Y1/ECO206Y1, ECO202Y1/ECO208Y1/ECO209Y1, ECO220Y1/ ECO227Y1/ (STA237H1, STA238H1)/ (STA247H1, STA248H1)/ (STA257H1, STA261H1), at least 1.0 credit in ECO at the 300+ level.",,Society and its Institutions (3),Social Science
ECO426H1 - Market Design,"This course presents the theory and practice of market design, including matching markets and auctions. Sample topics include: school choice, kidney exchange, spectrum auctions, and keyword auctions.",ECO316H1(60%)/ECO326H1,,Society and its Institutions (3),Social Science
ECO427H1 - Economics of Information,"This course examines the role and the use of information in strategic situations. The class will expand on the material covered in game theory classes and illustrate it with applications. Topics include: communication, signalling, building reputations, adverse selection, etc.",ECO316H1(60%)/ECO326H1,ECO421H1,Society and its Institutions (3),Social Science
ECO428H1 - Classical Economic Thought,"An examination of the price, distribution, and growth theories of major economic thinkers before 1870, from pre-classical contributions by Aristotle, Mercantilists, and Physiocrats to the classical authors Adam Smith, David Ricardo, T.R. Malthus, and Karl Marx.",ECO200Y1/ECO204Y1/ECO206Y1; ECO202Y1/ECO208Y1/ECO209Y1,,Society and its Institutions (3),Social Science
ECO429H1 - Economic Thought after 1870,"Economic analysis between 1870 and 1960, from the foundations of microeconomics by the Marginal Utility theorists of the 1870s (Jevons, Menger, and Walras), Alfred Marshall in the 1890s, and the capital theorists Bohm-Bawerk and Fisher in the early 1900s, to the Keynesian revolution in macroeconomics in the 1930s and Friedman's counter-revolution in the 1950s.",ECO200Y1/ECO204Y1/ECO206Y1; ECO202Y1/ECO208Y1/ECO209Y1,,Society and its Institutions (3),Social Science
ECO430Y1 - Reading Course or Thesis,Intended for advanced Specialist students who have exhausted course offerings in a particular area. Open only when a faculty member is available and willing to supervise. Students must obtain the approval of the Associate Chair for Undergraduate Studies before enrolling. Not eligible for CR/NCR option.,,,Society and its Institutions (3),Social Science
ECO431H1 - Reading Course or Thesis,Intended for advanced Specialist students who have exhausted course offerings in a particular area. Open only when a faculty member is available and willing to supervise. Students must obtain the approval of the Associate Chair for Undergraduate Studies before enrolling. Not eligible for CR/NCR option.,,,Society and its Institutions (3),Social Science
ECO434H1 - Topics in Political Economy,"This course surveys recent advances in political economy, emphasizing the critical evaluation of empirical evidence pertaining to political economic theories. Topics vary by year, but may include: voters and electoral competition, and the political economy of media and political agency.",ECO316H1/ECO326H1; ECO374H1/ECO375H1,,Society and its Institutions (3),Social Science
ECO435H1 - The Economics of Modern China,"A focus on post-1949 Chinese economy, and the PRCs economic legacy. Economic development during the Maoist period, particularly post-1979 reforms. China's experience is compared to Eastern Europe's and the role of China in the rapidly growing East Asian economy. This is a limited enrolment seminar requiring extensive reading.","ECO200Y1(70%)/ECO204Y1(70%)/ECO206Y1(70%); ECO220Y1/ ECO227Y1/ (STA237H1, STA238H1)/ (STA247H1, STA248H1)/ (STA257H1, STA261H1)",,Society and its Institutions (3),Social Science
ECO437H1 - Quantitative Macroeconomics,"In order to capture the complexity of economic behaviour and interactions, especially with a significant time dimension, modern models of the macroeconomy make considerable use of computer simulation. This course teaches students both how to develop the economic models, and how to solve and work with them computationally.",ECO325H1,,Society and its Institutions (3),Social Science
ECO438H1 - Topics in Behavioural Economics,"Behavioural Economics is a relatively new field that incorporates insights gained from psychological, experimental and neuroscientific studies. Research methods adapted from behavioural economics are now being employed in virtually every field in economics. The course will cover the main themes in behavioural economics: individual choices under risk and uncertainty, reference-dependent choices, intertemporal preferences, other-regarding preferences, bounded rationality in individual and interactive decision-making, and the measurement of rationality and recovery of preferences.","ECO200Y1/​ECO204Y1/​ECO206Y1, ECO220Y1/ ECO227Y1/ (STA237H1, STA238H1)/ (STA247H1, STA248H1)/ (STA257H1, STA261H1), at least 1.0 credit in ECO at the 300+ level.",ECO422H1,Society and its Institutions (3),Social Science
ECO439H1 - Empirical Methods in Microeconomics,"This course studies the methods used in modern program evaluation and micro-econometrics to identify causal effects in the presence of potentially unobserved confounding factors. Covers a range of methods and designs, both experimental and quasi-experimental. There is a heavy emphasis on the application of these methods to a broad range of economic questions.","(ECO375H1(60%)/ECO374H1(70%)) OR (ECO200Y1(80%)/ECO204Y1(80%)/ECO206Y1(80%), (ECO220Y1(80%)/ECO227Y1(80%))",,Society and its Institutions (3),Social Science
ECO446H1 - Advanced Public Economics,"Advanced topics in public economics and economic analysis of Canadian public policy. Through a mix of lectures and independent research, students will acquire theoretical and empirical tools for public policy analysis. Topics may include: income inequality and redistribution; fiscal federalism; taxation of corporate profits; and policies to deal with public goods and externalities.","ECO200Y1/ ECO204Y1/ ECO206Y1, ECO220Y1/ ECO227Y1/ (STA237H1, STA238H1)/ (STA247H1, STA248H1)/ (STA257H1, STA261H1), at least 1.0 credit in ECO at the 300+ level.",,Society and its Institutions (3),Social Science
ECO451H1 - Macroeconomic Growth,"Studies current empirical evidence, and corresponding theoretical models to explain and understand macroeconomic growth, and its varied experience across countries. Coverage and depth of treatment go beyond ECO362H1. Students may benefit from, but need not have taken ECO362H1.",ECO325H1(60%); ECO374H1(60%)/ECO375H1(60%),,Society and its Institutions (3),Social Science
ECO456H1 - Special Topics in Financial Economics,Courses may be offered in one or more subjects each year. Students must meet the prerequisites announced by the Department.,See the Department of Economics website for details.,,Society and its Institutions (3),Social Science
