Course Names,descriptions,prereq,Column 4,Breadth requirements,distribution requirements
ECO459H1 - International Trade Regulation,"The theory and political economy of international trade, with examination of specific trade institutions: Bretton Woods, WTO, NAFTA, tariff administration, most-favoured nation treatment, antidumping regulation, subsidies and countervailing duties, agriculture, trade in services, trade-related intellectual property, trade and environment, trade and developing countries.","ECO364H1, ECO365H1, permission of the instructor",,Society and its Institutions (3),Social Science
ECO461H1 - The Economics of Financial Risk Management,"This course is intended primarily for students in the Financial Economics specialist program and is not open to students in the BCom program. The role of risk management in both private and public sectors, a discussion of why firms and government should hedge financial risks; individual and social gains of financial risk management; identification and quantification of financial risks (including Value-at-Risk measures); how derivative securities can be used for financial risk management.",ECO358H1(70%),,Society and its Institutions (3),Social Science
ECO462H1 - Financial Econometrics,"This course is intended primarily for students in the Financial Economics specialist program. An introduction to the econometrics used in empirical finance, with an emphasis on estimation and inference using computer based applications. Topics will include: parametric and nonparametric models of volatility, evaluation of asset pricing theories, and models for risk management and transactions data.",ECO358H1(70%); ECO375H1(70%)/ ECO375H5(70%),,Society and its Institutions (3),Social Science
ECO463H1 - Financial Market Innovation,"A research-oriented course that explores the impact of technological developments on the industrial organization of financial markets. Topics include: the impact of the automated financial products and procedures (e.g., algorithmic trading and robo-advising) on the price formation process, the economic impact of new tools and technologies (e.g., blockchain, digital currencies, and predictive analytics such as machine learning), the emergence of alternative financing methods such as crowdfunding and peer-to-peer lending.",ECO200Y1(70%)/ECO204Y1(60%)/ECO206Y1(60%); ECO374H1(70%)/ECO375H1(70%)/CSC321H1/CSC411H1,,Society and its Institutions (3),Social Science
ECO464H1 - Empirical Financial Economics,"The course develops the tools used in empirical research in financial economics. Coverage may include: discrete choice models, duration models, instrumental variables, differences-in-differences, regression discontinuity, propensity score estimators, sample selection models and cumulative abnormal return calculation. Topics are drawn from: ownership structure, mergers and acquisitions, capital structure, payout policy, CEOs’ effect on the firm, executive compensation, insider trading, shareholder activism, and bank financing.",ECO358H1(70%)/ RSM332H1(70%); ECO374H1(70%)/ ECO375H1(70%)/ ECO375H5(70%)/ ECO327Y5(70%),,Society and its Institutions (3),Social Science
ECO465H1 - International Finance,An advanced course that addresses topics in international finance and macroeconomics. Potential topics include: foreign exchange market; exchange rate determination; empirical models of exchange rates; international financial markets and uncertainty; international CAPM and home bias; sovereign debt; optimal capital controls.,"One of the following: ECO365H1(80%)/(ECO325H1(60%), ECO374H1(60%))/(ECO325H1(60%), ECO375H1(60%))",,Society and its Institutions (3),Social Science
ECO466H1 - Empirical Macroeconomics and Policy,"This course builds on ECO325H1, ECO374H1 and ECO375H1 as students increase their data literacy and learn modelling techniques to address policy issues. The course covers how monetary policy is conducted, central bank use of general equilibrium models, and basic techniques for predicting key macroeconomic variables. The class is divided into teams which make regular presentations on current global and domestic issues, the economic outlook, and how the Bank of Canada should adjust monetary policy in the short run. Traditionally, at the end of the course, a team from ECO466H1 is chosen to compete in the Bank of Canada Governor’s Challenge.",ECO208Y1(70%)/ ECO209Y1(70%)/ ECO202Y1(75%)/ ECO325H1(70%); ECO374H1(70%)/ ECO375H1(70%); Permission of the instructor.,,Society and its Institutions (3),
ECO475H1 - Applied Econometrics II,"A research-oriented course continuing from ECO375H. The regression model is extended in several possible directions: time series analysis; panel data techniques; instrumental variables; simultaneous equations; limited dependent variables. Students will complete a major empirical term paper, applying the tools of econometrics to a topic chosen by the student.","ECO375H1(70%)/ECO374H1(80%), NOTE: STA302H1 is not accepted preparation.",ECO376H1,Society and its Institutions (3),Social Science
ECO499H1 - Honours Essay in Applied Microeconomics,"Students will complete an original research paper on a topic of their choosing. Topic must be microeconomic and applied, meaning all papers will involve data and quantitative (regression) analysis.","ECO200Y1/ECO204Y1/ECO206Y1; ECO202Y1/ECO208Y1/ECO209Y1; ECO220Y1/ ECO227Y1/ (STA237H1, STA238H1)/ (STA247H1, STA248H1)/ (STA257H1, STA261H1); ECO372H1/ECO374H1/ECO375H1; 3.0 GPA in economics courses; approval of the Associate Chair, Undergraduate.",,Society and its Institutions (3),Social Science