Course Names,descriptions,prereq,Column 4,Breadth requirements,distribution requirements
APM236H1 - Applications of Linear Programming,"Introduction to linear programming including a rapid review of linear algebra (row reduction, matrix inversion, linear independence), the simplex method with applications, the duality theorem, complementary slackness, the dual simplex method and the revised simplex method.",MAT221H1/MAT223H1/MAT240H1 (Note: no waivers of prerequisites will be granted),,The Physical and Mathematical Universes (5),Science
APM306Y1 - Mathematics and Law,This course examines the relationship between legal reasoning and mathematical logic; provides a mathematical perspective on the legal treatment of interest and actuarial present value; critiques ethical issues; analyzes how search engine techniques on massive databases transform legal research and considers the impact of statistical analysis and game theory on litigation strategies.|NOTE|This course counts as 0.5 FCE in BR3 and 0.5 FCE in BR5.|This course will only contribute 0.5FCE to the Math Minor program.,"(MAT135H1/MAT135H5/MAT136H1/MAT136H5)/MAT137Y1/MAT157Y1, MAT221H1/MAT223H1/MAT240H1",,"The Physical and Mathematical Universes (5), Society and its Institutions (3)",Science
APM346H1 - Partial Differential Equations,"Sturm-Liouville problems, Green's functions, special functions (Bessel, Legendre), partial differential equations of second order, separation of variables, integral equations, Fourier transform, stationary phase method.","MAT235Y1/  MAT235Y5/ ( MAT232H5,  MAT236H5)/ ( MATB41H3,  MATB42H3)/  MAT237Y1/  MAT237Y5/  MAT257Y1, ( MAT244H1/  MATB44H3/  MAT244H5/  MAT267H1)",,The Physical and Mathematical Universes (5),Science
APM348H1 - Mathematical Modelling,"An overview of mathematical modelling. A variety of approaches for representing physical situations mathematically followed by analytical techniques and numerical simulations to gain insight. Questions from biology, economics, engineering, medicine, physics, physiology, and the social sciences formulated as problems in optimization, differential equations, and probability. Precise content varies with instructor.","MAT244H1/MAT267H1, MAT224H1/MAT247H1, STA237H1/STA247H1/STA257H1/MAT377H1",MAT482,The Physical and Mathematical Universes (5),Science
APM396H1 - Independent Reading in Applied Mathematics,Independent study under the direction of a faculty member. Topic must be outside undergraduate offerings. Similar workload to a 36L course.  Not eligible for CR/NCR option.,Minimum GPA 3.5 for APM and MAT courses. Permission of the Associate Chair for Undergraduate Studies and of the prospective supervisor.,,The Physical and Mathematical Universes (5),Science
APM421H1 - Mathematical Foundations of Quantum Mechanics,"Key concepts and mathematical structure of Quantum Mechanics, with applications to topics of current interest such as quantum information theory. The core part of the course covers the following topics: Schroedinger equation, quantum observables, spectrum and evolution, motion in electro-magnetic field, angular momentum and O(3) and SU(2) groups, spin and statistics, semi-classical asymptotics, perturbation theory. More advanced topics may include: adiabatic theory and geometrical phases, Hartree-Fock theory, Bose-Einstein condensation, the second quantization, density matrix and quantum statistics, open systems and Lindblad evolution, quantum entropy, quantum channels, quantum Shannon theorems.|Joint undergraduate/graduate course - APM421H1/MAT1723H","(MAT224H1/MAT247H1, MAT337H1)/MAT357H1",,The Physical and Mathematical Universes (5),Science
APM426H1 - General Relativity,Einstein's theory of gravity. Special relativity and the geometry of Lorentz manifolds. Gravity as a manifestation of spacetime curvature. Einstein's equations. Cosmological implications: big bang and inflationary universe. Schwarzschild stars: bending of light and perihelion precession of Mercury. Topics from black hole dynamics and gravitational waves. The Penrose singularity theorem.|Joint undergraduate/graduate course - APM426H1/MAT1700H,MAT363H1/MAT367H1,,The Physical and Mathematical Universes (5),Science
APM441H1 - Asymptotic and Perturbation Methods,"Asymptotic series. Asymptotic methods for integrals: stationary phase and steepest descent. Regular perturbations for algebraic and differential equations. Singular perturbation methods for ordinary differential equations: W.K.B., strained co-ordinates, matched asymptotics, multiple scales. (Emphasizes techniques; problems drawn from physics and engineering)","APM346H1/MAT351Y1, MAT334H1/MAT354H1",,The Physical and Mathematical Universes (5),Science
APM446H1 - Applied Nonlinear Equations,"Partial differential equations appearing in physics, material sciences, biology, geometry, and engineering. Nonlinear evolution equations. Existence and long-time behaviour of solutions. Existence of static, traveling wave, self-similar, topological and localized solutions. Stability. Formation of singularities and pattern formation. Fixed point theorems, spectral analysis, bifurcation theory. Equations considered in this course may include: Allen-Cahn equation (material science), Ginzburg-Landau equation (condensed matter physics), Cahn-Hilliard (material science, biology), nonlinear Schroedinger equation (quantum and plasma physics, water waves, etc). mean curvature flow (geometry, material sciences), Fisher-Kolmogorov-Petrovskii-Piskunov (combustion theory, biology), Keller-Segel equations (biology), and Chern-Simmons equations (particle and condensed matter physics).|Joint undergraduate/graduate course - APM446H1/MAT1508H",APM346H1/MAT351Y1,,The Physical and Mathematical Universes (5),Science
APM461H1 - Combinatorial Methods,"A selection of topics from such areas as graph theory, combinatorial algorithms, enumeration, construction of combinatorial identities.|Joint undergraduate/graduate course - APM461H1/MAT1302H","MAT224H1/MAT247H1, MAT137Y1/MAT157Y1, MAT301H1/MAT347Y1",,The Physical and Mathematical Universes (5),Science
APM462H1 - Nonlinear Optimization,"An introduction to first and second order conditions for finite and infinite dimensional optimization problems with mention of available software. Topics include Lagrange multipliers, Kuhn-Tucker conditions, convexity and calculus of variations. Basic numerical search methods and software packages which implement them will be discussed.","(MAT223H1,MAT224H1) /MAT247H1, MAT235Y1/MAT237Y1/MAT257Y1",,The Physical and Mathematical Universes (5),Science
APM466H1 - Mathematical Theory of Finance,"Introduction to the basic mathematical techniques in pricing theory and risk management: Stochastic calculus, single-period finance, financial derivatives (tree-approximation and Black-Scholes model for equity derivatives, American derivatives, numerical methods, lattice models for interest-rate derivatives), value at risk, credit risk, portfolio theory.|Joint undergraduate/graduate course - APM466H1/MAT1856H","APM346H1, STA347H1",,The Physical and Mathematical Universes (5),Science
APM496H1 - Independent Readings in Applied Mathematics,Independent study under the direction of a faculty member. Topic must be outside current undergraduate offerings. Similar workload to a course that has 36 lecture hours. Not eligible for CR/NCR option.,minimum GPA 3.5 for APM and MAT courses. Permission of the Associate Chair for Undergraduate Studies and of the prospective supervisor,,The Physical and Mathematical Universes (5),Science
"JMB170Y1 - Biology, Models, and Mathematics","Applications of mathematics to biological problems in physiology, genetics, evolution, growth, population dynamics, cell biology, ecology, and behaviour. Mathematical topics include: power functions and regression; exponential and logistic functions; binomial theorem and probability; calculus, including derivatives, max/min, integration, areas, integration by parts, substitution; differential equations, including linear constant coefficient systems; dynamic programming; Markov processes; and chaos. This course is intended for students in Life Sciences.",,,The Physical and Mathematical Universes (5),Science
JUM202H1 - Mathematics as an Interdisciplinary Pursuit,"A study of the interaction of mathematics with other fields of inquiry: how mathematics influences, and is influenced by, the evolution of science and culture. Art, music, and literature, as well as the more traditionally related areas of the natural and social sciences may be considered. (Offered every three years)|JUM202H1 is particularly suited as a Science Distribution Requirement course for Humanities and Social Science students.",,,The Physical and Mathematical Universes (5),Science
JUM203H1 - Mathematics as a Recreation,"A study of games, puzzles and problems focusing on the deeper principles they illustrate. Concentration is on problems arising out of number theory and geometry, with emphasis on the process of mathematical reasoning. Technical requirements are kept to a minimum. A foundation is provided for a continuing lay interest in mathematics. (Offered every three years)|JUM203H1 is particularly suited as a Science Distribution Requirement course for Humanities and Social Science students.",,,The Physical and Mathematical Universes (5),Science
JUM205H1 - Mathematical Personalities,"An in-depth study of the life, times and work of several mathematicians who have been particularly influential. Examples may include Newton, Euler, Gauss, Kowalewski, Hilbert, Hardy, Ramanujan, Gödel, Erdös, Coxeter, Grothendieck. (Offered every three years)|JUM205H1 is particularly suited as a Science Distribution Requirement course for Humanities and Social Science students.",,,The Physical and Mathematical Universes (5),Science
MAT133Y1 - Calculus and Linear Algebra for Commerce,"Mathematics of finance. Matrices and linear equations. Review of differential calculus; applications. Integration and fundamental theorem; applications. Introduction to partial differentiation; applications.|NOTE: please note Prerequisites listed below. Students without the proper prerequisites for MAT133Y1 may be deregistered from this course.|Note that MAT133Y is not a valid prerequisite for a number of more advanced quantitative courses. Students who are considering a quantitative non-Commerce PoSt, such as a math minor or a stats minor, may want to consider MAT135H and MAT136H, MAT137Y, or MAT157Y instead of MAT133Y. Specifically, a student who took MAT133Y may need to subsequently take MAT135H and MAT136H as ""extra"" or take MAT137Y or MAT157Y in order to proceed in non-Commerce PoSts.",High school level calculus,,The Physical and Mathematical Universes (5),Science
MAT135H1 - Calculus I,"In this first introduction to Calculus, students will be introduced to the tools of differential calculus, the branch of calculus that is motivated by the problem of measuring how quantities change. Students will use these tools to solve other problems, including simplifying functions with straight lines, describing how different types of change are related, and computing maximum and minimum quantities. This course will focus on developing a deep understanding of why the tools of calculus make sense and how to apply them to the social, biological, and physical sciences. It will also emphasize translating between algebraic, graphical, numerical and verbal descriptions of each concept studied.",High school level calculus,,The Physical and Mathematical Universes (5),Science
MAT136H1 - Calculus II,"This second part of the introductory Calculus sequence focuses on integral calculus beginning with the Fundamental Theorem of Calculus, the connection between two seemingly unrelated problems: measuring changing quantities and finding areas of curved shapes. Students will develop a deep understanding of the integral, and use it to: unpack equations involving derivatives; to make sense of infinite sums; to write complicated functions as 'infinite polynomials'; and to compute areas, volumes, and totals in applied problems. This course will further develop students' abilities to translate between algebraic, graphical, numerical, and verbal descriptions of mathematics in a variety of applied contexts.",MAT135H1,,The Physical and Mathematical Universes (5),Science
MAT137Y1 - Calculus with Proofs,"A conceptual approach for students with a serious interest in mathematics. Attention is given to computational aspects as well as theoretical foundations and problem solving techniques. Review of Trigonometry. Limits and continuity, mean value theorem, inverse function theorem, differentiation, integration, fundamental theorem of calculus, elementary transcendental functions, Taylor's theorem, sequence and series, power series. Applications.",High school level calculus,,The Physical and Mathematical Universes (5),Science
MAT138H1 - Introduction to Proofs,"The goal of this course is for students to become comfortable with abstraction, rigour, logic, and proofs. They will practice reading and understanding mathematical statements, analyzing definitions and properties, formulating conjectures and generalizations, providing and writing reasonable and precise arguments, writing and critiquing proofs. The instructor may use specific mathematical content, which could vary from year to year, to practice these skills. The course is aimed at students interested in the creative character of mathematics, particularly those planning to take any of our proof-oriented courses, and is an excellent preparation for MAT137Y1, MAT157Y1, or MAT240H1.|Note: students may take this course concurrently with MAT157Y1 or MAT137Y1, or prior to registering in MAT157Y1 or MAT137Y1. This course can also be used by students who have already taken MAT136H1 and wish to bridge the gap to MAT237Y1.",High school level calculus,,The Physical and Mathematical Universes (5),Science
MAT157Y1 - Analysis I,"A theoretical course in calculus; emphasizing proofs and techniques, as well as geometric and physical understanding. Trigonometric identities. Limits and continuity; least upper bounds, intermediate and extreme value theorems. Derivatives, mean value and inverse function theorems. Integrals; fundamental theorem; elementary transcendental functions. Techniques of integration. Taylor's theorem; sequences and series; uniform convergence and power series.",High school level calculus,,The Physical and Mathematical Universes (5),Science
MAT192H1 - Liberating Mathematics,"Currently, mathematics is at a crossroads between tradition and progress. Progress has been led in large part by women mathematicians, in particular Black women, Indigenous women, and women from visible minorities. Intertwined in their studies of mathematics is a daring critique of traditional mathematics, re-imagining of mathematics culture, and more. This course will compare and contrast new forms of accessible mathematics with standard sources that draw dominantly on the experiences and narratives of men. Restricted to first-year students. Not eligible for CR/NCR option.",High school level algebra.,,The Physical and Mathematical Universes (5),Science
MAT193H1 - Women’s Mathematics,"Mathematics has been shaped in significant ways by the work of outstanding female mathematicians such as Hypatia, Emmy Noether, Sofia Kovalevskaya, and Maryam Mirzakhani. Despite these successes, women still experience barriers to entering the field and participating at the highest levels. This course will blend an exploration of mathematics created by women with a study of the issue of women in mathematics. Students will have the opportunity to examine the complex factors that impact women’s participation in STEM, learn about the lives of female mathematicians, create their own mathematics, and sharpen their spatial cognition and logical thinking skills. Restricted to first-year students. Not eligible for CR/NCR option.",High school level algebra.,,The Physical and Mathematical Universes (5),Science
MAT198H1 - Cryptology: The Mathematics of Secrecy and Security,"How do we send our own confidential information through secure channels, and how can we break codes to uncover the secret information of our adversaries? The mathematical field of cryptology is dedicated to answering such questions. In this course we will study breakthroughs in cryptology, from secret messages in the ancient world and the Enigma cipher in World War II, to modern cryptosystems that facilitate online commerce. Along the way, you will develop a sophisticated understanding of how numbers interact and develop the ability to communicate messages secretly and mathematics clearly. Restricted to first-year students. Not eligible for CR/NCR option.",High school level algebra.,,The Physical and Mathematical Universes (5),Science
MAT199H1 - Aha! Mathematical Discovery and Creative Problem Solving,"This course is an exploration into the creative process and use of imagination as they arise in the context of mathematical problem solving. The problems, which are all at a pre-calculus level, are chosen primarily by the criterion of aesthetic appeal, and emphasize reasoning rather than technique. Still, many of them are quite challenging, and substantial independent thinking will be required, the course is therefore appropriate for students from a variety of backgrounds and disciplines, including hard sciences. Its goal will be to hone each participant's creativity and mathematical problem-solving skills while guiding them towards the `Aha!' experience which accompanies independent discovery. Restricted to first-year students. Not eligible for CR/NCR option.",High school level algebra,,The Physical and Mathematical Universes (5),Science
MAT221H1 - Applied Linear Algebra,"An application-oriented approach to linear algebra, based on calculations in standard Euclidean space. Systems of linear equations, matrices, Gauss-Jordan elimination, subspaces, bases, orthogonal vectors and projections. Matrix inverses, kernel and range, rank-nullity theorem. Determinants, eigenvalues and eigenvectors, Cramer's rule, diagonalization. This course has strong emphasis on building computational skills in the area of algebra. Applications to curve fitting, economics, Markov chains and cryptography.",High school level calculus,,The Physical and Mathematical Universes (5),Science
MAT223H1 - Linear Algebra I,"Systems of linear equations, matrix algebra, real vector spaces, subspaces, span, linear dependence and independence, bases, rank, inner products, orthogonality, orthogonal complements, Gram-Schmidt, linear transformations, determinants, Cramer's rule, eigenvalues, eigenvectors, eigenspaces, diagonalization.",High school level calculus,,The Physical and Mathematical Universes (5),Science
MAT224H1 - Linear Algebra II,"Fields, complex numbers, vector spaces over a field, linear transformations, matrix of a linear transformation, kernel, range, dimension theorem, isomorphisms, change of basis, eigenvalues, eigenvectors, diagonalizability, real and complex inner products, spectral theorem, adjoint/self-adjoint/normal linear operators, triangular form, nilpotent mappings, Jordan canonical form.",MAT221H1(80%)/MAT223H1/MAT240H1/MATA22H3,,The Physical and Mathematical Universes (5),Science
MAT235Y1 - Multivariable Calculus,"Parametric equations and polar coordinates. Vectors, vector functions and space curves. Differential and integral calculus of functions of several variables. Line integrals and surface integrals and classic vector calculus theorems. Examples from life sciences and physical science applications.","(MAT135H1/MAT135H5/MATA30H3/MATA31H3, MAT136H1/MAT136H5/MATA36H3/MATA37H3)/MAT135Y5/MAT137Y1/MAT137Y5/MAT157Y1/MAT157Y5",,The Physical and Mathematical Universes (5),Science
MAT237Y1 - Multivariable Calculus with Proofs,"Sequences and series. Uniform convergence. Convergence of integrals. Elements of topology in R^2 and R^3. Differential and integral calculus of vector valued functions of a vector variable, with emphasis on vectors in two and three dimensional euclidean space. Extremal problems, Lagrange multipliers, line and surface integrals, vector analysis, Stokes' theorem, Fourier series, calculus of variations.","MAT137Y1/MAT157Y1/(MAT135H1/MAT135H5, MAT136H1(85%)/MAT136H5 (85%), MAT138H1), MAT223H1/MAT240H1",,The Physical and Mathematical Universes (5),Science
MAT240H1 - Algebra I,"A theoretical approach to: vector spaces over arbitrary fields, including C and Z_p. Subspaces, bases and dimension. Linear transformations, matrices, change of basis, similarity, determinants. Polynomials over a field (including unique factorization, resultants). Eigenvalues, eigenvectors, characteristic polynomial, diagonalization. Minimal polynomial, Cayley-Hamilton theorem.",High school level calculus,,The Physical and Mathematical Universes (5),Science
MAT244H1 - Introduction to Ordinary Differential Equations,"First order ordinary differential equations: Direction fields, integrating factors, separable equations, homogeneous equations, exact equations, autonomous equations, modeling. Existence and uniqueness theorem. Higher order equations: Constant coefficient equations, reduction of order, Wronskian, method of undetermined coefficients, variation of parameters. Solutions by series and integrals. First order linear systems, fundamental matrices. Non-linear equations, phase plane, stability. Applications in life and physical sciences and economics.","(MAT135H1/MAT135H5/MATA35H3/MATA30H3/MATA31H3, MAT136H1/MAT136H5/MATA36H3/MATA37H3)/MAT135Y5/MAT137Y1/MAT137Y5/MAT157Y1/MAT157Y5, MAT223H1/MATA23H3/MAT223H5/MAT240H1/MAT240H5",,The Physical and Mathematical Universes (5),Science
MAT245H1 - Mathematical Methods in Data Science,"An introduction to the mathematical methods behind scientific techniques developed for extracting information from large data sets. Elementary probability density functions, conditional expectation, inverse problems, regularization, dimension reduction, gradient methods, singular value decomposition and its applications, stability, diffusion maps. Examples from applications in data science and big data.","MAT137Y1/MAT157Y1, MAT223H1/MAT240H1, MAT224H1/MAT247H1",,The Physical and Mathematical Universes (5),Science
MAT246H1 - Concepts in Abstract Mathematics,"Designed to introduce students to mathematical proofs and abstract mathematical concepts. Topics may include modular arithmetic, sizes of infinite sets, and a proof that some angles cannot be trisected with straightedge and compass.","MAT133Y1/(MAT135H1/MAT135H5, MAT136H1/MAT136H5)/MAT137Y1,MAT223H1/MAT240H1",,The Physical and Mathematical Universes (5),Science
MAT247H1 - Algebra II,"A theoretical approach to real and complex inner product spaces, isometries, orthogonal and unitary matrices and transformations. The adjoint. Hermitian and symmetric transformations. Spectral theorem for symmetric and normal transformations. Polar representation theorem. Primary decomposition theorem. Rational and Jordan canonical forms. Additional topics including dual spaces, quotient spaces, bilinear forms, quadratic surfaces, multilinear algebra.",MAT240H1/MAT240H5,,The Physical and Mathematical Universes (5),Science
MAT257Y1 - Analysis II,"Topology of R^n; compactness, functions and continuity, extreme value theorem. Derivatives; inverse and implicit function theorems, maxima and minima, Lagrange multipliers. Integration; Fubini's theorem, partitions of unity, change of variables. Differential forms. Manifolds in R^n; integration on manifolds; Stokes' theorem for differential forms and classical versions.","MAT157Y1/MAT157Y5, MAT247H1/MAT247H5",,The Physical and Mathematical Universes (5),Science
MAT267H1 - Advanced Ordinary Differential Equations,"A theoretical course on Ordinary Differential Equations. First-order equations: separable equations, exact equations, integrating factors. Variational problems, Euler-Lagrange equations. Linear equations and first-order systems. Fundamental matrices, Wronskians. Non-linear equations. Existence and uniqueness theorems. Method of power series. Elementary qualitative theory; stability, phase plane, stationary points. Oscillation theorem, Sturm comparison. Applications in mechanics, physics, chemistry, biology and economics.","MAT157Y1/MAT157Y5, MAT247H1/MAT247H5",,The Physical and Mathematical Universes (5),Science
MAT271H1 - Insights from Mathematics,This breadth course is accessible to students with limited mathematical background. Various mathematical techniques will be illustrated with examples from humanities and social science disciplines. Some of the topics will incorporate user friendly computer explorations to give participants the feel of the subject without requiring skill at calculations.|Note: This course cannot be used to satisfy requirements of program in the math department.,,,The Physical and Mathematical Universes (5),Science
MAT282H1 - Topics in Mathematics,"A course in mathematics on a topic outside the current undergraduate offerings. For information on the specific topic to be studied and possible additional prerequisites, go to http://www.math.toronto.edu/cms/current-students-ug/",1.0 MAT credit at the 100-level. Possible additional topic-specific prerequisites.,,The Physical and Mathematical Universes (5),Science
MAT295H1 - Independent Reading in Mathematics,Independent study under the direction of a faculty member.  Topic must be outside undergraduate offerings.  Similar workload to a 36L course.  Not eligible for CR/NCR option.,Minimum GPA of 3.5 in APM and MAT courses. Permission of the Associate Chair for Undergraduate Studies and of the prospective supervisor.,,The Physical and Mathematical Universes (5),Science
