Course Names,descriptions,prereq,Breadth requirements,distribution requirements
MIN400H1 - Geology Field Camp for Engineers,"At Geology Field Camp, students will learn to incorporate geological observations into their engineering data sets. The course will focus on the recognition of rock types in the field, mapping of geological structures related to mineralization of potential economic importance, and field measurement techniques for obtaining rock engineering data. Students will learn how to make geological observations that are of critical importance to their success as mineral engineers, and to foster a sense of excitement and curiosity about the rocks that form the physical environment within which they will work as professionals. The course will be taught in the Sudbury region where there are several operating mines, numerous excellent field exposures of rocks related to the formation of the impact-related Sudbury structure, inexpensive accommodations, as well as unrelated older rock sequences typical of Archean greenstone belts where much of Canada's mineral exploration takes place. Students attend the two week Geology Field Camp prior to the start of Fourth Year Fall Session.","GLG207H1, GLG345H1, MIN429H1",,
MIN450H1 - Mineral Economics,"Course covers the evaluation of mineral projects, mining operations, and mining companies. Topics will include: discounted cash flow techniques including net present value (NPV), internal rate of return (IRR), net asset value (NAV); feasibility studies and due diligence reports; reserves and resources, data sources; metal prices and markets; cash flow modeling including revenue calculations, capital and operating costs, taxes, depreciation, inflation; risk and risk assessment, discount rates, red flags, checklists; financing. Guest lectures will provide industry insights into financing, fund raising, consulting, project control, and evaluation. There are two assignments: review of an annual report; due diligence report and net asset value calculation.",CIV368H1/CME368H1,,
MIN466H1 - Mineral Project Design I,"Mineral Project Design is a two-part capstone course that draws on all course materials developed in the first three years of the Mineral Engineering Curriculum. The course will culminate in the design of a mining or civil rock engineering project. In the first half of the course (F) students perform individual detailed case history analyses. Additional instruction in technical aspects of communication is provided during both semesters (preparing and writing technical reports, industry research and analysis, presentation skills, as well as other technical elements as required). These skills will form a foundation for students to use in industry. Critical non-technical aspects of rock engineering projects will also be examined, and guest speakers will present on specialized topics such as: cultural and social effects of rock engineering projects on communities and the environment; economic planning and impact; ethical considerations; aboriginal land claims, etc.. The social license to operate will be emphasized. Students will receive a final grade at the end of each term course, but both courses must be taken in sequence. (MIN 467H1 S cannot be taken without successful completion of MIN 466H1 F)","MIN429H1, MIN350H1",,
MIN467H1 - Mineral Project Design II,"Mineral Project Design is a two-part capstone course that draws on all course materials developed in the first three years of the Mineral Engineering Curriculum. Part II (S) focuses on the design of a mining or civil rock engineering project. Students will be grouped into teams and provided with one or more data sets and a design problem to solve. The end product is a major engineering design report and oral presentation (including several interim reports and presentations). Technical aspects will serve to examine a ""cradle to grave"" view of a project, from initial planning through to final closure and site remediation. The course will include an intensive two-day Professional Supervisors Short Course. Topics include: Discovering a commonality among supervisors and their key role in maintaining standards. The importance of sharing information and expectations about costs, production goals and business objectives are explored in the context of motivation. The necessity of successful communication skills and techniques are discussed and demonstrated to achieve behaviours on the job, producing consistent results. A reliable methodology for handling difficult situations is provided. The fundamental rationale for safety and loss control is presented as well as a relevant perspective on management structure. A workable code of conduct that is a guide to professional behaviour is developed. Students will receive a final grade at the end of each term course, but both courses must be taken in sequence (MIN 467H1 S cannot be taken without successful completion of MIN 466H1 F)",MIN466H1,,
MIN470H1 - Ventilation and Occupational Health,"Hydraulics of air flow through underground openings is studied leading to mine ventilation design calculations and ventilation network analysis. Related topics discussed in the course include: statutory regulations and engineering design criteria; application and selection of ventilation fans; auxiliary fan design; air conditioning (heating and cooling); dust and fume control; ventilation economics. Health hazards related to mine gasses, dust and radiation along with relevant statutory requirements are reviewed. Air quality and quantity measurement and survey techniques are presented.",CIV270H1/CME270H1,,
MIN511H1 - Integrated Mine Waste Engineering,"The engineering design of conventional mine waste management systems, including tailings ponds, rock dumps, and underground mine backfill systems, is considered first. Emerging trends in integrated mine waste management systems, including paste stacking and ""paste rock"" on surface, and cemented paste backfill forunderground mining will then be covered. Engineering case studies will be used throughout, and each case study will be evaluated in terms of how the mine waste systems used contribute to the economic and environmental sustainability of the mining operation.",CME321H1,,
MIN565H1 - Design and Support of Underground Mine Excavations,"Geomechanical issues concerning the design of underground openings in hard rock are covered in the course: ground support [i.e. rock mass reinforcement] design, the dimensioning and sequencing of underground excavations and rock pillar design in hard rock applications. A review of modern concepts concerning rock and rock mass failure modes with application to support design is given. Both static and dynamic [rockburst] support design issues are addresses. Lastly instrumentation and monitoring techniques and backfill design and behaviour are also covered. Design issues are illustrated through the use of numerous field case studies .",MIN429H1/CIV529H1,,
MSE202H1 - Thermodynamics I,"The three laws of thermodynamics, Heat capacity theory and Debye's law. Calculations of enthalpy, entropy, and free energy of pure materials and reactions. Reversible and irreversible processes. Gibbs free energy, chemical equilibria, and phase rule. Introduction of Ellingham, Pourbaix, and pre-dominance area diagrams. Treatment of ideal and non-ideal solutions with the introduction of the concept of activity and activity coefficient. Binary and ternary phase diagrams and their applications to materials processing and materials properties. Thermodynamics of electrochemical systems.",,,
MSE301H1 - Mineral Processing,"Introduction to the theory and practice of mineral beneficiation. Topics covered include comminution, sizing, froth flotation, gravity separation, magnetic separation, electrostatic separation, dewatering and tailings management. The course also covers relevant aspects of sampling, particle size measurement, metallurgical accounting, material balances, surface chemistry and the movement of solid particles in liquid media. Open to 3rd and 4th year Minerals, Materials, and Chemical Engineering students, or with permission of the instructor.",MIN225H1 or MSE244H1,,