Course Names,descriptions,prereq,Breadth requirements,distribution requirements
APS100H1 - Orientation to Engineering,"This course is designed to help students transition into first-year engineering studies and to develop and apply a greater understanding of the academic learning environment, the field of engineering, and how the fundamental mathematics and sciences are used in an engineering context. Topics covered include: study skills, time management, problem solving, successful teamwork, effective communications, exam preparation, stress management and wellness, undergraduate research, extra- and co-curricular involvement, engineering disciplines and career opportunities, and applications of math and science in engineering.",,,
APS106H1 - Fundamentals of Computer Programming,"An introduction to computer systems and software. Topics include the representation of information, algorithms, programming languages, operating systems and software engineering. Emphasis is on the design of algorithms and their implementation in software. Students will develop a competency in the Python programming language. Laboratory exercises will explore the concepts of both Structure-based and Object-Oriented programming using examples drawn from mathematics and engineering applications.",,,
APS110H1 - Engineering Chemistry and Materials Science,"This course is structured around the principle of the structure-property relationship. This relationship refers to an understanding of the microstructure of a solid, that is, the nature of the bonds between atoms and the spatial arrangement of atoms, which permits the explanation of observed behaviour. Observed materials behaviour includes mechanical, electrical, magnetic, optical, and corrosive behaviour. Topics covered in this course include: structure of the atom, models of the atom, electronic configuration, the electromagnetic spectrum, band theory, atomic bonding, optical transparency of solids, magnetic properties, molecular bonding, hybridized orbitals, crystal systems, lattices and structures, crystallographic notation, imperfections in solids, reaction rates, activation energy, solid-state diffusion, materials thermodynamics, free energy, and phase equilibrium.",,,
APS111H1 - Engineering Strategies & Practice I,"This course introduces and provides a framework for the design process. Students are introduced to communication as an integral component of engineering practice. The course is a vehicle for understanding problem solving and developing communications skills. This first course in the two Engineering Strategies and Practice course sequence introduces students to the process of engineering design, to strategies for successful team work, and to design for human factors, society and the environment. Students write team and individual technical reports.",,,
APS112H1 - Engineering Strategies & Practice II,"This course introduces and provides a framework for the design process, problem solving and project management. Students are introduced to communication as an integral component of engineering practice. The course is a vehicle for practicing team skills and developing communications skills. Building on the first course, this second course in the two Engineering Strategies and Practice course sequence introduces students to project management and to the design process in greater depth. Students work in teams on a term length design project. Students will write a series of technical reports and give a team based design project presentation.",,,
BME331H1 - Physiological Control Systems,"Introduces physiological concepts and selected physiological control systems present in the human body, and proposes quantitative modeling approaches for these systems. Topics covered will include (1) the endocrine system and its subsystems, including glucose regulation and the stress response, (2) the cardiovascular system and related aspects such as cardiac output, venous return, control of blood flow by the tissues, and nervous regulation of circulation, and (3) the nervous and musculoskeletal systems, including the control of voluntary motion. Linear control theory will be used to develop skills in system modeling and examine concepts of system response and system control in the context of a healthy human body.",CHE353H1,,
CHE112H1 - Physical Chemistry,"A course in physical chemistry. Topics discussed include systems and their states, stoichiometry, the properties of gases, the laws of chemical thermodynamics (calculations involving internal energy, enthalpy, free energy, and entropy), phase equilibrium, chemical equilibrium, ionic equilibrium, acids and bases, solutions, colligative properties, electrochemistry, and corrosion.",,,
CHE324H1 - Process Design,"This course presents the philosophy and typical procedures of chemical engineering design projects. The course begins at the design concept phase. Material and energy balances are reviewed along with the design of single unit operations and equipment specification sheets. The impact of recycles on equipment sizing is covered. Safety, health and environmental regulations are presented. These lead to the development of safe operating procedures. The systems for developing Piping and Instrumentation diagrams are presented. Process safety studies such as HAZOPS are introduced. Typical utility systems such as steam, air and vacuum are discussed. Project economics calculations are reviewed.",,,
CHE332H1 - Reaction Kinetics,"The rates of chemical processes. Topics include: measurement of reaction rates, reaction orders and activation energies; theories of reaction rates; reaction mechanisms and networks; development of the rate law for simple and complex kinetic schemes; approach to equilibrium; homogeneous and heterogeneous catalysis. Performance of simple chemical reactor types.",,,
CHE333H1 - Chemical Reaction Engineering,"Covers the basics of simple reactor design and performance, with emphasis on unifying the concepts in kinetics, thermodynamics and transport phenomena. Topics include flow and residence time distributions in various reactor types as well as the influence of transport properties (bulk and interphase) on kinetics and reactor performance. The interplay of these facets of reaction engineering is illustrated by use of appropriate computer simulations.",,,
CHE353H1 - Engineering Biology,"Using a quantitative, problem solving approach, this course will introduce basic concepts in cell biology and physiology. Various engineering modelling tools will be used to investigate aspects of cell growth and metabolism, transport across cell membranes, protein structure, homeostasis, nerve conduction and mechanical forces in biology.",,,
CHE354H1 - Cellular and Molecular Biology,"This course will cover the principles of molecular and cellular biology as they apply to both prokaryotic and eukaryotic cells. Topics will include: metabolic conversion of carbohydrates, proteins, and lipids; nucleic acids; enzymology; structure and function relationships within cells; and motility and growth. Genetic analysis, immunohistochemistry, hybridomis, cloning, recombinant DNA and biotechnology will also be covered. This course will appeal to students interested in environmental microbiology, biomaterials and tissue engineering, and bioprocesses.",CHE353H1,,
"CHE562H1 - Applied Chemistry IV - Applied Polymer Chemistry, Science and Engineering","This course serves as an introduction to concepts in polymer chemistry, polymer science and polymer engineering. This includes a discussion of the mechanisms of step growth, chain growth and ring-opening polymerizations with a focus on industrially relevant polymers and processes. The description of polymers in solution as well as the solid state will be explored. Several modern polymer characterization techniques are introduced including gel permeation chromatography, differential scanning calorimetry, thermal gravimetric analysis and others.",,,
CHE565H1 - Aqueous Process Engineering,"Application of aqueous chemical processing to mineral, environmental and industrial engineering. The course involves an introduction to the theory of electrolyte solutions, mineral-water interfaces, dissolution and crystallization processes, metal ion separations, and electrochemical processes in aqueous reactive systems. Applications and practice of (1) metal recovery from primary (i.e. ores) and secondary (i.e. recycled) sources by hydrometallurgical means, (2) treatment of aqueous waste streams for environmental protection, and (3) production of high-value-added inorganic materials.",,,
CIV100H1 - Mechanics,"The principles of statics are applied to composition and resolution of forces, moments and couples. The equilibrium states of structures are examined. Throughout, the free body diagram concept is emphasized. Vector algebra is used where it is most useful, and stress blocks are introduced. Shear force diagrams, bending moment diagrams and stress-strain relationships for materials are discussed. Stress and deformation in axially loaded members and flexural members (beams) are also covered.",,,
ECE110H1 - Electrical Fundamentals,"An overview of the physics of electricity and magnetism: Coulomb's law, Gauss' law, Ampere's law, Faraday's law. Physics of capacitors, resistors and inductors. An introduction to circuit analysis: resistive circuits, nodal and mesh analysis, 1st order RC and RL transient response and sinusoidal steady-state analysis.",,,
ECE335H1 - Introduction to Electronic Devices,"Electrical behaviour of semiconductor structures and devices. Metal-semiconductor contacts; pn junctions, diodes, photodetectors, LED's; bipolar junction transistors, Ebers-Moll and hybrid-pi models; field effect transistors, MOSFET, JFET/MESFET structures and models; thyristors and semiconductor lasers.",MAT291H1 and ECE221H1 and ECE231H1,,
FOR424H1 - Innovation and Manufacturing of Sustainable Materials,"Sustainable materials are a mandate for sustainable societies. This course will explore the manufacturing, engineering principles and design fundamentals for creating sustainable materials from renewable resources. Special emphasis will be on bioplastics, biofibre, nanobiofibre, biocomposites and nanobiocomposites. Written communication and design skills will be developed through tutorials and assignments.",,,
MAT186H1 - Calculus I,"Topics include: limits and continuity; differentiation; applications of the derivative - related rates problems, curve sketching, optimization problems, L'Hopital's rule; definite and indefinite integrals; the Fundamental Theorem of Calculus; applications of integration in geometry, mechanics and other engineering problems.",,,
MAT187H1 - Calculus II,"Topics include: techniques of integration, an introduction to mathematical modeling with differential equations, infinite sequences and series, Taylor series, parametric and polar curves, vector-valued functions, partial differentiation, and application to mechanics and other engineering problems.",APS162H1/MAT186H1,,
MAT188H1 - Linear Algebra,"This course covers systems of linear equations and Gaussian elimination, applications; vectors in Rn, independent sets and spanning sets; linear transformations, matrices, inverses; subspaces in Rn, basis and dimension; determinants; eigenvalues and diagonalization; systems of differential equations; dot products and orthogonal sets in Rn; projections and the Gram-Schmidt process; diagonalizing symmetric matrices; least squares approximation. Includes an introduction to numeric computation in a weekly laboratory.",,,
MAT294H1 - Calculus and Differential Equations,"Partial differentiation, grad, div, curl, multiple integrals, line integrals, surface integrals, differential equations, first order differential equations, homogeneous linear differential equations, boundary conditions. Formulation of various problems relevant to materials and mining engineering - the concepts above are used.",,,
MIE221H1 - Manufacturing Engineering,"Production Fundamentals: Metal casting; metal forming - rolling, forging, extrusion and drawing, and sheet-metal forming; plastic/ceramic/glass forming; metal removal - turning, drilling/ boring/reaming, milling, and grinding; non-traditional machining - ECM, EDM and laser cutting; welding; surface treatment; metrology. Environmental issues in manufacturing processes, recycling of materials. Automation Fundamentals: Automation in material processing and handling - NC, robotics and automatically-guided vehicles; flexible manufacturing - group technology, cellular manufacturing and FMS; and computer-aided design - geometric modelling, computer graphics, concurrent engineering and rapid prototyping.|Instruction and assessment of communication centered around course deliverables that will form part of an ongoing design portfolio.",,,
MIE243H1 - Mechanical Engineering Design,"Introduction to basic mechanical parts and mechanisms: gears, cams, bearings, linkages, actuators and motors, chain and belt drives, brakes and clutches, hydraulics and pneumatics. Tutorials on engineering drawing, sketching, and CAD/CAM in SolidWorks: views and drawing types, 2D sketching, 3D modeling and engineering drawing generation, modeling of assembly and motion analysis/animation. Conceptual design examples and mechanical engineering design process, including selection and applications of mechanisms. Dissection and reverse engineering of selected mechanical devices, mechanisms, and subsystems. Competitive group design project including technical report and 3D printing.|Instruction and assessment of communication centered around course deliverables that will form part of an ongoing design portfolio.",,,
MIE258H1 - Engineering Economics and Accounting,"Engineering economic and accounting concepts needed in the design of engineering systems. Financial analysis topics include: financial statements, depreciation, income tax, and basic accounting techniques. Project analysis topics includes: time value of money, evaluation of cash flows, defining alternatives, analysis of independent projects, acceptance criteria, buy or lease, make or buy, replacement analysis, economic analysis in the public sector, project risk and uncertainty. Inflation concepts.",MIE231H1/MIE236H1 or equivalent,,
MIE304H1 - Introduction to Quality Control,Introduction to quality engineering. Quality standards and certification. TQM. Modeling processes with simulation. Making inferences about product quality from real or simulation output data. Introduction to statistical process control. Control charts for variables and attributes. Process capability analysis. Lot Acceptance Sampling.,MIE231 or equivalent,,
MIE311H1 - Thermal Energy Conversion,"Engineering applications of thermodynamics in the analysis and design of heat engines and other thermal energy conversion processes within an environmental framework. Steam power plants, gas cycles in internal combustion engines, gas turbines and jet engines. Refrigeration, psychrometry and air conditioning. Fossil fuel combustion and advanced systems includes fuel cells.","MIE210H1, MIE313H1",,
MIE320H1 - Mechanics of Solids II,"Three-dimensional stress transformation, strain energy, energy methods, finite element method, asymmetric and curved beams, superposition of beam solutions, beams on elastic foundations, buckling, fracture mechanics, yield criteria, stress concentration, plane stress and strain.",MIE222H1,,
MIE342H1 - Circuits with Applications to Mechanical Engineering Systems,"This course presents analysis of complex circuits and application of circuit principles to design circuits for mechanical engineering systems. Discussions will centre around circuits and instrumentation. In-depth discussions will be given on a number of topics: (1) Mechatronics design applications of circuit principles; (2) Network theorems, node-voltage, mesh-current method, Thévenin equivalents; (3) Operational amplifier circuits; (4) 1st and 2nd order circuits; (5) Laplace transform, frequency response; (6) Passive and active filter design (low- and high-pass filters, bandpass and bandreject filters); (7) Interface/readout circuits for mechanical engineering systems, sensors, instrumentation; (8) Inductance, transformers, DC/AC machines; (9) Digital circuit and data samplingintroduction.",MAT186H1 and MAT187H1,,
MIE364H1 - Quality Control and Improvement,"In manufacturing and service industries alike, quality is viewed as an important strategic tool for increasing competitiveness. Continuous quality improvement is a key factor leading to a company's success. With more emphasis on quality, the cost and the product cycle time are reduced and the communication between producer and customer is improved. The course focuses on the following topics: introduction to quality engineering, TQM, quality standards, supplier-producer relations and quality certification, costs of quality, statistical process control for long and short production runs, process capability analysis and acceptance sampling, quality certification, six sigma quality, quality improvement using designed experiments and an overview of the Taguchi Methods.",MIE236H1 or equivalent,,
"MSE120H1 - Materials Engineering, Processing and Application","This course covers an introduction to the field of materials science and engineering following a design-led approach. Application areas such as stiffness-limited design, fracture-limited design, strength-limited design will be used to guide further investigations into elements of the processing-structure-properties-performance paradigm. Topics covered will include material property charts, computer-aided design and materials selection, crystallographic planes and directions, crystal structures, stiffness, strength, plasticity, yielding, ductility, fracture and fracture toughness, cyclic loading and fatigue, friction and wear, thermal properties of materials, electrical properties, optical properties, materials corrosion, and materials processing.",,,
MSE191H1 - Introduction to Materials Science and Engineering,"This is a seminar series that will introduce students to the community, upper-year experience, and core fields of Materials Science and Engineering. Seminar presenters will represent the major areas in Materials Science and Engineering and will also be drawn from an array of groups, including students, staff, faculty, and alumni. The format will vary and may include application examples, case studies, career opportunities, and research talks. The purpose of the seminar series is to provide first year students with some understanding of the various options within the Department to enable them to make educated choices as they progress through the program. This course will be offered on a credit/no credit basis.",,,
MSE202H1 - Thermodynamics I,"The three laws of thermodynamics, Heat capacity theory and Debye's law. Calculations of enthalpy, entropy, and free energy of pure materials and reactions. Reversible and irreversible processes. Gibbs free energy, chemical equilibria, and phase rule. Introduction of Ellingham, Pourbaix, and pre-dominance area diagrams. Treatment of ideal and non-ideal solutions with the introduction of the concept of activity and activity coefficient. Binary and ternary phase diagrams and their applications to materials processing and materials properties. Thermodynamics of electrochemical systems.",,,
MSE217H1 - Diffusion and Kinetics,"Topics in the Diffusion part include: diffusion mechanisms, steady-state and non-steady-state diffusion, Fick's first and second laws, Kirkendall effect, short-circuit diffusions, diffusion in metallic, polymeric, ionic and semiconducting materials, Darken's first and second equations, marker's velocity, thin film diffusion. Topics in the Kinetics part include: experimental rate laws, reaction orders, determination of order of reaction (integral, differential, and half-life methods), Arrhenius equation, elucidation of mechanism, fluid-particle reactions, kinetic models (progressive-conversion, unreacted core, shrinking core model), reactor design (batch, plug flow, and mixed flow reactors).",,,
MSE218H1 - Phase Transformations,"A key part of MSE is focused on explaining how material systems transform from one condensed phase to another. These phase transformations are a critical aspect of understanding the behaviour of a material. MSE 218 builds on the thermodynamics and phase stability of MSE 202 and runs in parallel to the rates of transformation seen in MSE 217. In MSE 218 we will consider phase transformations in one component, two component, and multicomponent systems. We will look at both diffusional and diffusionless transformations, focusing on the nucleation and growth aspects of each case. Specific examples will include: solidification, precipitation, recrystallization, spinodal, massive, and order-disorder transformations. Both experimental and computational labs will be used to outline specific transformations in more depth.",,,
MSE219H1 - Structure and Characterization of Materials,"Introduction to two and three-dimensional crystallography and crystal structures of solids. Topics include: Pearson and Hermann-Mauguin symbols, reciprocal space, point group and space group symmetry analysis, stereographic projections. Introduction to tensor analysis of crystalline material properties, and symmetry breakdown by imperfections in crystals. Experimental techniques used to interpret structure and chemistry of solids and their defects will be covered theoretically and in the laboratory including: X-ray diffractometry, optical, electron and scanning probe microscopy, and surface/bulk spectroscopies based on optical, X-ray, electron and ion-beam analysis methods.",,,
MSE222H1 - Mechanics of Solid Materials,Principles of stress and strains; Axial loading; Torsion; Shear forces and bending moments; Stresses in Beams; Plane stresses and strains; Pressure vessels; Deflection of beams; Introduction to Finite Element Analysis,,,
MSE235H1 - Materials Physics,"Application of solid state physics to describe properties of materials. Thermal properties of solids: lattice vibrations (phonons), heat capacity, thermal conductivity. Electrical properties of metals: simple circuits, resistivity of metals (classical and quantum descriptions), Seebeck, Peltier, and Thomson effects. Electrical properties of semiconductors: band structure and occupancy, conductivity, Hall effect, simple devices. Electrical properties of insulators: polarization, capacitance, optical properties, ferroelectric and piezoelectric materials. Magnetic properties: diamagnetism and paramagnetism, ferromagnetic and ferrimagnetic materials, magnetic domains, B-H curves.",,,
MSE238H1 - Engineering Statistics and Numerical Methods,"This course will teach engineering statistics and numerical methods with Python. Topics on statistics will include probability theory, hypothesis testing, discrete and continuous distribution, analysis of variance, sampling distributions, parameter estimation, regression analysis, statistical quality control and six-sigma. The topics on numerical methods will include curve fitting and interpolation, solving linear and nonlinear equations, numerical differentiation and integration, solution of ordinary and partial differential equations, initial and boundary value problems.",,,
MSE244H1 - Inorganic Materials Chemistry and Processing,"Basic materials processing flowsheet including priIntroduction to atomic and molecular structures, acid-base and redox reactions, transition metal complexes, and detailed chemical properties of the main group elements in the periodic table. Examples of industrial practice in metal processing industry and energy generation/storage technologies. Hands-on qualitative and quantitative analyses of inorganic compounds, by both classical ""wet"" volumetric and instrumental methods.mary processing and recycling of materials. Materials and energy balance of individual units and of overall process flowsheets. Use of computer software for flowsheet evaluation. Translating process flowsheets to resource and utility requirements, capital/operating cost, and environmental impact of processing operations. Basics of equipment sizing, operation scheduling, and plant layout.",,,
MSE245H1 - Organic Materials Chemistry and Properties,"Introduction to organic chemistry and organic materials. Naming, bonding and shapes of organic molecules. Properties and reactions of organic compounds. Key mechanisms including electrophilic addition, nucleophilic aliphatic substitution, β-elimination reactions and electrophilic aromatic substitution. Syntheses of polymers (step-growth and radical chain growth polymerization) and processing methods. Structure and properties of polymeric materials (amorphous, crystalline, elastomeric). Thermo-transition properties of polymers. Life-cycle of polymers, mechanisms of degradation and strategies of polymer recycle. Hands-on organic syntheses and separation experiments.",,,
MSE250H1 - Materials Selection in Design I,The basic principles underlying the selection and design of engineering materials for different applications are identified. The application of Cambridge Engineering Selection computer software during material selection. Selected case studies. (Half term course taught during last 6 weeks of term),,,
MSE296H1 - Materials Paradigm at a Glance I,"Materials come in all sorts of forms and exhibit a wide range of behaviors, yet there is more in common to their explanation than there is difference. MSE296 & MSE297 will put the threads from the second year curriculum into a common informational framework more reflective of the emerging state-space based materials paradigm. This course will meet on a biweekly basis. Credit is obtained by participating in in-class exercises.",,,
