Course Names,descriptions,prereq,Breadth requirements,distribution requirements
MSE297H1 - Materials Paradigm at a Glance II,"Materials come in all sorts of forms and exhibit a wide range of behaviors, yet there is more in common to their explanation than there is difference. MSE296 & MSE297 will put the threads from the second year curriculum into a common informational framework more reflective of the emerging state-space based materials paradigm. This course will meet on a biweekly basis. Credit is obtained by participating in in-class exercises.",,,
MSE298H1 - Communications,"This full year laboratory, tutorial, and lecture course builds on the communication principles students learned in first year. Students will work in teams on open-ended design projects, and scaffolded assignments will provide students the opportunity to report on their projects in written reports, podium presentations, and poster presentations. The projects in this course are supported by laboratory exercises and tutorial activities designed to help students build engineering drawing skills with an emphasis on the SolidWorks package.",,,
MSE301H1 - Mineral Processing,"Introduction to the theory and practice of mineral beneficiation. Topics covered include comminution, sizing, froth flotation, gravity separation, magnetic separation, electrostatic separation, dewatering and tailings management. The course also covers relevant aspects of sampling, particle size measurement, metallurgical accounting, material balances, surface chemistry and the movement of solid particles in liquid media. Open to 3rd and 4th year Minerals, Materials, and Chemical Engineering students, or with permission of the instructor.",MIN225H1 or MSE244H1,,
MSE302H1 - Thermodynamics II,"Introduction to statistical thermodynamics. The concept of chemical potential and its application in solution thermodynamics. Solution models. Equilibrium in multi-component, multi-phase systems. Thermodynamics of surfaces and interfaces. Applied thermodynamics with examples of industrial applications. Computational thermodynamics.",,,
MSE316H1 - Mechanical Behaviour of Materials,"The mechanical behaviour of engineering materials including metals, alloys, ceramics and polymeric materials. The following topics will be discussed: macro- and micro-structural response of materials to external loads; load-displacement and stress-strain relationships, processes and mechanisms of elastic, visco-elastic, plastic and creep deformation, crystallographic aspects of plastic flow, effect of defects on mechanical behaviour, strain hardening theory, strengthening mechanisms and mechanical testing.",,,
MSE332H1 - Heat and Mass Transfer for Materials Processing,"Fundamental concepts of heat and mass transfer as applied in materials engineering. Steady state and transient analysis in slabs, cylinders and spheres through solutions of problems in metallurgy and material processing. Similarity between heat and mass transfer. Concepts of momentum, mass and thermal boundary layers. Coupled problems.",,,
MSE335H1 - Materials Physics,"Application of solid state physics to describe properties of materials. Thermal properties of solids: lattice vibrations (phonons), heat capacity, thermal conductivity. Electrical properties of metals: simple circuits, resistivity of metals (classical and quantum descriptions), Seebeck, Peltier, and Thomson effects. Electrical properties of semiconductors: band structure and occupancy, conductivity, Hall effect, simple devices. Electrical properties of insulators: polarization, capacitance, optical properties, ferroelectric and piezoelectric materials. Magnetic properties: diamagnetism and paramagnetism, ferromagnetic and ferrimagnetic materials, magnetic domains, B-H curves.",,,
MSE342H1 - Nanomaterials,"An introduction to nanostructured materials. Topics include: the different classes of nanomaterials, synthesis and characterization methods, changes in physical properties on the nanometer scale, areas of application of nanostructured materials and materials issues in nanotechnology. (Quarter term course taught over the entire Fall term, worth .25 credits).",,,
MSE343H1 - Biomaterials,"Provides an overview of the field of biomaterials, introducing fundamental biological and materials design and selection concepts, and is open to CHE students. Key applications of materials for biomedical devices will be covered, along with an introduction to the expected biological responses. The concept of biocompatibility will be introduced along with the essential elements of biology related to an understanding of this criterion for biomaterial selection and implant design. In addition, structure-property relationships in both biological and bio-inspired materials will be highlighted.",,,
MSE351H1 - Design and Sim of Materials Processes,"An overview of computer modeling approaches to analyze various macro-scale phenomena involved in materials processing, product design, and manufacturing. These approaches will include weighted residual methods, finite element and finite difference methods, computational fluid dynamics, and multiphysics simulations. The students will apply these methods to study heat transfer, fluid flow, stress analysis, structural dynamics, and coupled behavior. Practical experience will be provided on commercial finite element (FE) and computer-aided design (CAD) packages such as ANSYS and SOLIDWORKS.",,,
MSE355H1 - Materials Production,"Materials life cycle, primary and secondary resources, resource life and sustainability. Technologies and unit operations used in the production of light metals, non-ferrous and ferrous metals. Energy use and conservation in production of materials. Benefits and technologies of recycling. Treatment of waste streams for value recovery and safe disposal",,,
MSE390H1 - Communications II,"The goals of Communication II are to i) gain in-depth knowledge of a specific area of work within a broader field of Materials Science and Engineering ii) read technical materials that will allow you to advance in the field iii) organize, write and present about the ideas of the field at a level of sophistication and clarity appropriate to university and iv) present clear, well-organized technical presentations.",,,
MSE398Y1 - Materials Manufacturing and Design,"Bringing together concepts from across our entire curriculum, including Mechanical Behaviour of Materials, Phase Transformations, Heat and Mass Transport, and Thermodynamics, MSE398 explains the processing-microstructure-properties-performance paradigm underlying several manufacturing techniques. This full year course connects materials selection, CAD drawing (and simulation) and the basics of manufacturing methods for component and product design. The course culminates in a project in which students complete the design, prototyping, simulation, cost modelling and validation for product design of their own choosing.",,,
MSE401H1 - Materials Information in Design,,,,
MSE415H1 - Environmental Degradation of Materials,"This course deals with four major areas: electrochemistry of low temperature aqueous solvents, the corrosion of materials, mechano-chemical effects in materials and corrosion prevention in design. Electrochemistry deals with thermodynamics of material-electrolyte systems involving ion-solvent, ion-ion interactions, activity coefficients, Nernst equation and Pourbaix diagrams, and rate theory through activation and concentration polarization. Corrosion of metallic, polymeric, ceramic, composite, electronic and biomaterials will be explored along with mechano-chemical effects of stress corrosion, hydrogen embrittlement and corrosion fatigue. Corrosion prevention in terms of case histories and the use of expert systems in materials selection.",,,
MSE419H1 - Fracture and Failure Analysis,"Fracture mechanisms and mechanics of solid materials. Topics include: nature of brittle and ductile fracture, macro-phenomena and micro-mechanisms of failure of various materials, mechanisms of fatigue; crack nucleation and propagation, Griffith theory, stress field at crack tips, stress intensity factor and fracture toughness, crack opening displacement, energy principle and the J-integral, fracture mechanics in fatigue, da/dN curves and their significance. Practical examples of fatigue analysis and fundamentals of non-destructive testing.",,,
MSE421H1 - Solid State Processing and Surface Treatment,"The fundamentals and technologies of mechanical forming (rolling, forging, extrusion, drawing, sheet-metal forming), sintering and powder forming, thermo-mechanical processing and heat treatment are discussed. Various means to enhance surfaces for the purposes of i) improving corrosion and erosion properties, ii) change mechanical, chemical or electric properties, iii) produce a visually more appealing surface are also covered. Techniques include galvanizing, hot dipping, nitriding, vapour deposition, plasma spraying.",,,
MSE430H1 - Electronic Materials,"Materials parameters and electronic properties of semiconductors are discussed as basic factors in the engineering of semiconductor devices. Materials parameters are related to preparation and processing methods, and thus to the electronic properties. The implications of materials parameters and properties on selected simple devices are discussed.",,,
MSE431H1 - Forensic Engineering,"The course provides participants with an understanding of scientific and engineering investigation methods and tools to assess potential sources, causes and solutions for prevention of failure due to natural accidents, fire, high and low speed impacts, design defects, improper selection of materials, manufacturing defects, improper service conditions, inadequate maintenance and human error. The fundamentals of accident reconstruction principles and procedures for origin and cause investigations are demonstrated through a wide range of real world case studies including: medical devices, sports equipment, electronic devices, vehicular collisions, structural collapse, corrosion failures, weld failures, fire investigations and patent infringements. Compliance with industry norms and standards, product liability, sources of liability, proving liability, defense against liability and other legal issues will be demonstrated with mock courtroom trial proceedings involving invited professionals to elucidate the role of an engineer as an expert witness in civil and criminal court proceedings.",MSE101H1/APS104H1/MSE260H1 or MSE160H1,,
MSE435H1 - Optical and Photonic Materials,"Optical and photonic materials play a central role in a variety of application fields including telecommunications, metrology, manufacturing, medical surgery, computing, spectroscopy, holography, chemical synthesis, and robotics - to name a few. The properties of light and its interaction with matter lie at the heart of this ever-expanding list of applications. The syllabus comprises the nature of light, wave motion, lasers, interference, coherence, fibre optics, diffraction, polarized light, photonic crystals, metamaterials, plasmonic materials, and practical design applications.",,,
MSE437H1 - Process Metallurgy of Iron and Steel,"The production and refining of liquid iron in the iron blast furnace, the production and refining of liquid steel, secondary refining operations, continuous casting and thermomechanical processing (hot rolling). Specialty steels and newly emerging technologies (e.g. thin slab casting, direct ironmaking) are also discussed in terms of process/environment and productivity. Downstream topics will include cold rolling, batch and continuous annealing, and coating operations.",,,
MSE438H1 - Computational Materials Design,"Introduces computational design of materials at atomic scale by focusing on two of the most powerful techniques - density functional theory (DFT) and molecular dynamics (MD). At the heart of both these techniques lies atomistic understanding originating from quantum mechanics; thus the initial lectures will review basics of quantum mechanics to inspire the foundational principles of modern-day DFT approaches. Thereafter theoretical background of DFT and its implementation and application for materials design will be covered. Specific topics on DFT will include Kohn-Sham equations, plane-wave basis sets, exchange and correlation, and nudged-elastic band calculations. Topics concerning MD will include foundational principles, Born-Oppenheimer hypothesis, time integration schemes such as velocity-verlet scheme, and interatomic potential functions. Finally, students will be exposed to the concepts and case-studies pertaining to multi-scale modeling. A particular emphasis of the course is providing hands-on training on open source software packages such as VESTA, Quantum-ESPRESSO, and LAMMPS.",MSE335H1/PHY356H1/PHY452H1/ECE330H1,,
MSE440H1 - BIomaterial Processing and Properties,"Currently used biomaterials for formation of surgical implants and dental restorations include selected metals, polymers, ceramics, and composites. The selection and processing of these materials to satisfy biocompatibility and functional requirements for applications in selected areas will be presented. Materials used for forming scaffolds for tissue engineering, and strategies for repair, regeneration and augmentation of degenerated or traumatized tissues will be reviewed with a focus on biocompatibility issues and required functionality for the intended applications.",MSE343H1 or equivalent,,
MSE443H1 - Composite Materials Engineering,"This course is designed to provide an integrated approach to composite materials design, and provide a strong foundation for further studies and research on these materials. Topics include: structure, processing, and properties of composite materials; design of fillers reinforcements and matrices reinforcements, reinforcement forms, nanocomposites systems, manufacturing processes, testing and properties, micro and macromechanics modeling of composite systems; and new applications of composites in various sectors.",,,
MSE450H1 - Plant and Process Design,"Basic materials processing flowsheet including primary processing and recycling of materials. Materials and energy balance of individual units and of overall process flowsheets. Use of computer software for flowsheet evaluation. Translating process flowsheets to resource and utility requirements, capital/operating cost, and environmental impact of processing operations. Basics of equipment sizing, operation scheduling, and plant layout.",,,
MSE451H1 - Advanced Physical Properties of Structural Nanomaterials,"This course deals with the physical properties of bulk nanostructured materials. Included are mechanical properties (elastic behavior, tensile and compressive strength, creep, wear and fatigue properties) electrical properties (electrical transport phenomena, electrical resistivity) magnetic properties (paramagnetic, diamagnetic, soft and hard ferromagnetic, superparamagnetic and antiferromagnetic properties), thermodynamic properties (interfacial enthalpy, thermal stability, phase transformations, heat capacity). The considerable differences observed for nanocrystalline solids compared to conventional polycrystalline and amorphous solids will be discussed in terms of the microstructural differences for these materials.",,,
MSE455H1 - Process Simulation and Computer Design,"Various production processes use simulation software to shorten the route from the initial design to finished product. Simulation software provides the designer and practicing engineer with a powerful tool in the tasks of improving and optimizing the industrial processes. Expensive trials can be avoided and the quality of the finished product secured from the beginning of production. First, this course will cover the basics of the process simulation used in industrial setting. Subsequently, the course will focus on industrial process simulation software used extensively in foundry industry worldwide. Essential elements of CAD/CAM techniques will be covered. Numerical simulation of the filling and solidification in castings will be presented. Calculation of foundry processes with multiple production cycles will be analyzed. Another course feature will be the graphical presentation of the results on the screen. Limited enrolment.",,,
MSE458H1 - Nanotechnology in Alternate Energy Systems,"The unique surface properties and the ability to surface engineer nanocrystalline structures renders these materials to be ideal candidates for use in corrosion, catalysis and energy conversion devices. This course deals with the fabrication of materials suitable for use as protective coatings, and their specific exploitation in fields of hydrogen technologies (electrolysis, storage, and fuel cells) linked to renewables. These new devices are poised to have major impacts on power generation utilities, the automotive sector, and society at large. The differences in observed electrochemical behavior between amorphous, nanocrystalline and polycrystalline solid materials will be discussed in terms of their surface structure and surface chemistry. A major team design project along with demonstrative laboratory exercises constitutes a major portion of this course. Limited Enrolment.",,,
MSE459H1 - Synthesis of Nanostructured Materials,"Various synthesis techniques to produce nanostructured materials will be introduced. These include methods involving the vapor phase (physical and chemical vapor deposition, organometallic chemical vapor deposition), the liquid phase (rapid solidification, spark erosion), the solid phase, (mechanical attrition, equal channel deformation) as well techniques producing these structures from solution (electrodeposition, electroless processing, precipitation). Secondary processing techniques to produce final products or devices will also be discussed.",,,
MSE461H1 - Engineered Ceramics,"The unique combinations of physical, electrical, magnetic, and thermomechanical properties exhibited by advanced technical ceramics has led to a wide range of applications including automobile exhaust sensors and fuel cells, high speed cutting tool inserts and ball bearings, thermal barrier coatings for turbine engines, and surgical implants. This course examines the crystal and defect structures which determine the electrical and mass transport behaviours and the effects of microstructure on optical, magnetic, dielectric, and thermomechanical properties. The influence of these structure-property relations on the performance of ceramic materials in specific applications such as sensors, solid oxide fuel cells, magnets, and structural components is explored.",,,
MSE462H1 - Materials Physics II,"Electron quantum wave theory of solid-state materials will be introduced. Quantum phenomena in various materials systems, in particular nano materials, will be discussed. Electronic properties of materials such as charge transport, dielectric properties, optical properties, magnetic properties, and thermal properties will be discussed using appropriate quantum theory. Materials systems to be studied may include metals, semiconductors, organics, polymers, and insulators.",,,
MSE478H1 - Materials Manufacturing and Design Laboratory II,"This half year design course focuses on the simulation informed design and execution of a product and continues on the concepts learned in MSE398. Working in small groups, students will use the principles of materials selection and computer simulation to design and build a product of their own choosing. This design focused course will guide students through several iterations of their product design, each iteration further informed by computer simulation. Materials selection will include selection for mechanical design, process, and shape and will also be used to inform each iteration of the design process. Finally, computer simulation results will be experimentally validated in parts of, or the entire the final product. This course will involve significant time involved in hands-on manufacturing. The course is accepted as one of the Advanced Electives for the Advanced Manufacturing Minor.",MSE398Y1,,
MSE490H1 - Professional Ethics and Practice,The various roles of a practicing engineer in industry and society will be presented through a series of seminars. The lecturers will include practicing engineers from local companies and consulting firms and representatives from professional and technical societies.,,,
MSE498Y1 - Capstone Project: Design of Materials Processes,"The students, working in small groups complete a project involving design of a materials processing plant, leading to a design report delivered at the conclusion of the course. The topics covered in the lectures and design process include basic materials processing flowsheet for primary processing and recycling of materials, materials and energy balance of individual units and of overall process flowsheets, use of computer software for flowsheet evaluation, translating process flowsheets to resource and utility requirements, energy analysis, capital/operating cost, basics of equipment sizing, operation scheduling, safety and HAZOP, plant layout, and design for sustainability.",,,
MSE550H1 - Advanced Physical Properties of Structural Nanomaterials,"This course deals with the physical properties of bulk nanostructured materials. Included are mechanical properties (elastic behavior, tensile and compressive strength, creep, wear and fatigue properties) electrical properties (electrical transport phenomena, electrical resistivity) magnetic properties (paramagnetic, diamagnetic, soft and hard ferromagnetic, superparamagnetic and antiferromagnetic properties), thermodynamic properties (interfacial enthalpy, thermal stability, phase transformations, heat capacity). The considerable differences observed for nanocrystalline solids compared to conventional polycrystalline and amorphous solids will be discussed in terms of the microstructural differences for these materials.",,,
MSE558H1 - Nanotechnology in Alternate Energy Systems,"The unique surface properties and the ability to surface engineer nanocrystalline structures renders these materials to be ideal candidates for use in corrosion, catalysis and energy conversion devices. This course deals with the fabrication of materials suitable for use as protective coatings, and their specific exploitation in fields of hydrogen technologies (electrolysis, storage, and fuel cells) linked to renewables. These new devices are poised to have major impacts on power generation utilities, the automotive sector, and society at large. The differences in observed electrochemical behavior between amorphous, nanocrystalline and polycrystalline solid materials will be discussed in terms of their surface structure and surface chemistry. A major team design project along with demonstrative laboratory exercises constitutes a major portion of this course. Limited Enrolment.",,,