Course Names,descriptions,prereq,Breadth requirements,distribution requirements
PHY431H1 - Topics in Biological Physics,An introduction to the physical phenomena involved in the biological processes of living cells and complex systems. Models based on physical principles applied to cellular processes will be developed. Biological computational modeling will be introduced.,"PHY250H1, PHY252H1/CHM222H1/CHM225Y1, PHY331H1",The Physical and Mathematical Universes (5),Science
PHY450H1 - Relativistic Electrodynamics,"An introduction to relativistic electrodynamics. Topics include: special relativity, four-vectors and tensors, relativistic dynamics from the Principle of Stationary Action and Maxwell's equations in Lorentz covariant form. Noether's theorem for fields and the energy-momentum tensor. Fields of moving charges and electromagnetic radiation: retarded potential, Lienard-Wiechert potentials, multipole expansion, radiation reaction.",PHY350H1,The Physical and Mathematical Universes (5),Science
PHY452H1 - Statistical Mechanics,"Classical and quantum statistical mechanics of noninteracting systems; the statistical basis of thermodynamics; ensembles, partition function; thermodynamic equilibrium; stability and fluctuations; formulation of quantum statistics; theory of simple gases; ideal Bose and Fermi systems.","PHY252H1, PHY356H1",The Physical and Mathematical Universes (5),Science
PHY454H1 - Continuum Mechanics,"The theory of continuous matter, including solid and fluid mechanics. Topics include the continuum approximation, dimensional analysis, stress, strain, the Euler and Navier-Stokes equations, vorticity, waves, instabilities, convection and turbulence.","PHY254H1,  MAT235Y1/ MAT237Y1/ MAT257Y1,  APM346H1/ APM351Y1",The Physical and Mathematical Universes (5),Science
PHY456H1 - Quantum Mechanics II,Quantum dynamics in Heisenberg and Schrödinger pictures; WKB approximation; variational method; time-independent perturbation theory; spin; addition of angular momentum; time-dependent perturbation theory; scattering.,PHY356H1,The Physical and Mathematical Universes (5),Science
PHY460H1 - Nonlinear Physics,"The theory of nonlinear dynamical systems with applications to many areas of physics. Topics include stability, bifurcations, chaos, universality, maps, strange attractors and fractals. Geometric, analytical and computational methods will be developed.",PHY354H1,The Physical and Mathematical Universes (5),Science
PHY471Y1 - Supervised Study in Physics,"An individual study program chosen by the student with the advice of, and under the direction of, a staff member. A student may take advantage of this course either to specialize further in a field of interest or to explore interdisciplinary fields not available in the regular syllabus. Consult the department web pages for some possible topics. This course may also be available in the summer. Not eligible for CR/NCR option.",Consult the Physics Associate Chair (Undergraduate Studies).,The Physical and Mathematical Universes (5),Science
PHY472H1 - Supervised Study in Physics,"An individual study program chosen by the student with the advice of, and under the direction of, a staff member. A student may take advantage of this course either to specialize further in a field of interest or to explore interdisciplinary fields not available in the regular syllabus. Consult the department web pages for some possible topics. This course may also be available in the summer. Not eligible for CR/NCR option.",Consult the Physics Associate Chair (Undergraduate Studies).,The Physical and Mathematical Universes (5),Science
PHY478H1 - Undergraduate Research Project,"An individual experimental or theoretical research project undertaken with the advice of, and under the direction of, a staff member. A student may take advantage of this course either to specialize further in a field of interest or to explore independent research. Consult the department web site for some possible topics. This course may also be available in the summer. Not eligible for CR/NCR option.",Consult the Physics Associate Chair (Undergraduate Studies),The Physical and Mathematical Universes (5),Science
PHY479Y1 - Undergraduate Research Project,"An individual experimental or theoretical research project undertaken with the advice of, and under the direction of, a faculty member. A student may take advantage of this course either to specialize further in a field of interest or to explore independent research. Consult the department web site for possible topics. This course may also be available in the summer. Not eligible for CR/NCR option.",Consult the Physics Associate Chair (Undergraduate Studies),The Physical and Mathematical Universes (5),Science
PHY483H1 - Relativity Theory I,"Basis of Einstein's theory: differential geometry, tensor analysis, gravitational physics leading to General Relativity. Theory starting from solutions of Schwarzschild, Kerr, etc.","PHY350H1, PHY354H1",The Physical and Mathematical Universes (5),Science
PHY484H1 - Relativity Theory II,"Applications of General Relativity to Astrophysics and Cosmology. Introduction to black holes, large-scale structure of the universe.",PHY483H1,The Physical and Mathematical Universes (5),Science
PHY485H1 - Laser Physics,"This course, which is intended to be an introduction to research in optical sciences, covers the statistics of optical fields and the physics of lasers. Topics include the principles of laser action, laser cavities, properties of laser radiation and its propagation, the diffraction of light, and spatial and temporal coherence.","PHY350H1, PHY358H1, PHY385H1/ECE318H1",The Physical and Mathematical Universes (5),Science
PHY487H1 - Condensed Matter Physics,"Introduction to foundational concepts of condensed matter physics in the solid state. Main topics to be covered: crystal structure, reciprocal lattice, x-ray diffraction, crystal binding, lattice vibrations, phonons and electrons in solids, Fermi surfaces, energy bands, semiconductors and magnetism. Special topics to be surveyed: superconductivity and nanoelectronic transport.","PHY250H1, PHY252H1, PHY356H1",The Physical and Mathematical Universes (5),Science
PHY489H1 - Introduction to High Energy Physics,"This course introduces the basics of fundamental particles and the strong, weak and electromagnetic forces that govern their interactions in the Standard Model of particle physics. Topics include relativistic kinematics, conservation laws, particle decays and scattering processes, with an emphasis on the techniques used for calculating experimental observables.","PHY354H1, PHY356H1",The Physical and Mathematical Universes (5),Science
PHY491H1 - Current Interpretations of Quantum Mechanics,"Different interpretations of quantum mechanics are presented and discussed, comparing and contrasting the various approaches to understanding the formalism of the theory.  We begin with “textbook quantum mechanics” and then discuss the Copenhagen view, operationalist quantum mechanics, hidden variable theories, Bohm-de Broglie theory, consistent histories, relational quantum mechanics, relative state approaches (many minds and many worlds), QBism, the interactional interpretation, and collapse theories.",PHY456H1,The Physical and Mathematical Universes (5),Science
PHY492H1 - Advanced Atmospheric Physics,"A preparatory course for research in experimental and theoretical atmospheric physics. Content will vary from year to year. Themes may include techniques for remote sensing of the Earth's atmosphere and surface; theoretical atmosphere-ocean dynamics; the physics of clouds, precipitation, and convection in the Earth's atmosphere.","PHY250H1, MAT235Y1/MAT237Y1/MAT257Y1",The Physical and Mathematical Universes (5),Science