Course Names,descriptions,prereq,Breadth requirements,distribution requirements
ENV237H1 - Physics of the Changing Environment A,"The course will cover basic physics of environmental processes and of measurement techniques in the atmosphere, the ocean, lake-land-forest systems, and other biological systems. It will place its work in the context of climate change and other aspects of environmental change. This course is solely intended for students who have NOT completed a previous first year physics core course, who are in one of the following programs: Environmental Science Major or Minor, Environmental Geosciences Specialist or Earth and Environmental Systems Major.","MAT135H1/ MAT136H1/ MAT137Y1/ MAT157Y1/ JMB170Y1,  CHM136H1/ CHM138H1/ CHM135H1/ CHM139H1/ CHM151Y1",The Physical and Mathematical Universes (5),Science
ENV238H1 - Physics of the Changing Environment B,"The course will cover basic physics of environmental processes and of measurement techniques in the atmosphere, the ocean, lake-land-forest systems, and other biological systems. It will place its work in the context of climate change and other aspects of environmental change. This course is solely intended for students who have completed a previous first year physics core course, who are in one of the following programs: Environmental Science Major or Minor, Environmental Geosciences Specialist or Earth and Environmental Systems Major.","MAT135H1/ MAT136H1/ MAT137Y1/ MAT157Y1/ JMB170Y1,  CHM136H1/ CHM138H1/ CHM135H1/ CHM139H1/ CHM151Y1,  PHY131H1/ PHY132H1/ PHY151H1/ PHY152H1",The Physical and Mathematical Universes (5),Science
JPE395H1 - Physics of the Earth,"Designed for students interested in the physics of the Earth and the planets. Study of the Earth as a unified dynamic system; determination of major internal divisions in the planet; development and evolution of the Earth's large scale surface features through plate tectonics; the age and thermal history of the planet; Earth's gravitational field and the concept of isostasy; mantle rheology and convection; Earth tides; geodetic measurement techniques, in particular modern space-based techniques.","PHY132H1/PHY152H1/PHY180H1/MIE100H1, MAT235Y1/MAT237Y1/MAT291H1/AER210H1, PHY254H1/PHY293H1/MAT244H1/MAT267H1/MAT290H1/MAT292H1",The Physical and Mathematical Universes (5),Science
JPE493H1 - Seismology,"Why do earthquakes occur and how are they related to tectonic motion of the Earth's surface? What is the physics behind the propagation of seismic waves through the Earth, and how can it be used to determine the internal structures of the Earth? This introductory course is aimed at understanding the physics behind seismic wave propagation, as well as asymptotic and numerical solutions to the elastodynamic equation. Travel time and amplitude of seismic waves are discussed based on seismic ray theory, while numerical methods are introduced to obtain accurate solutions to more complex velocity structures. Seismic tomographic methods, including their applications to hydrocarbon reservoir imaging, are also covered.","JPE395H1, APM346H1/APM351Y1/MAT351Y1",The Physical and Mathematical Universes (5),Science
JPH311H1 - From Universal Gravity to Quantum Information: The Making of Modern Physics,"Topics in the history of physics from antiquity to the 20th century, including Aristotelian physics, Galileo, Descartes, electromagnetism, thermodynamics, statistical mechanics, relativity, quantum physics, and particle physics. The development of theories in their intellectual and cultural contexts.",At least a 0.5 credit PHY course at university level,The Physical and Mathematical Universes (5),"Humanities, Science"
JPH441H1 - Physical Science in Contemporary Society,"This course will discuss the complex, real-life, ethical, and philosophical issues behind how science gets done, including questions such as how we as scientists strive to determine the truth; who determines what science is done, and on what basis; how we as a community manage science and make decisions about education, authorship, publication, hiring, et cetera (including issues related to equity, inclusivity, and diversity); and how we as a society fund science and apply its discoveries.","PHY224H1/ PHY250H1/ PHY252H1/ PHY254H1/ PHY256H1, or by permission of the instructor.",Society and its Institutions (3),Humanities
PHY100H1 - The Magic of Physics,"This course provides a survey of Physics, including both Classical and Modern Physics. It is designed for non-scientists, and assumes no background in either science or mathematics. The approach to the course is broad rather than deep. We will concentrate on the concepts underlying such fascinating topics as planetary motion, chaos, the nature of light, time travel, black holes, matter waves, Schrodinger's cat, quarks, and climate change. We will uncover the wonders of the classical and the quantum worlds courtesy of Galileo, Newton, Maxwell, Einstein, Heisenberg and many others.|(PHY100H1 is primarily intended as a Breadth Requirement course for students in the Humanities and Social Science)",,The Physical and Mathematical Universes (5),Science
PHY131H1 - Introduction to Physics I,"A first university physics course primarily for students not intending to pursue a Specialist or Major program in Physical or Mathematical Sciences. Topics include: classical kinematics & dynamics, momentum, energy, force, friction, work, power, angular momentum, oscillations, waves, sound.",,The Physical and Mathematical Universes (5),Science
PHY132H1 - Introduction to Physics II,"The second university physics course primarily for students not intending to pursue a Specialist or Major program in Physical or Mathematical Sciences. Topics include: electricity, magnetism, light, optics, special relativity.",PHY131H1/PHY151H1,The Physical and Mathematical Universes (5),Science
PHY151H1 - Foundations of Physics I,"The first physics course in many of the Specialist and Major Programs in Physical Sciences. It provides an introduction to the concepts, approaches and tools the physicist uses to describe the physical world while laying the foundation for classical and modern mechanics. Topics include: mathematics of physics, energy, momentum, conservation laws, kinematics, dynamics, and special relativity.",MCV4U Calculus & Vectors / MCB4U Functions & Calculus; SPH4U Physics,The Physical and Mathematical Universes (5),Science
PHY152H1 - Foundations of Physics II,"The concept of fields will be introduced and discussed in the context of gravity and electricity. Topics include rotational motion, oscillations, waves, electricity and magnetism.",PHY131H1/PHY151H1/PHY180H1,The Physical and Mathematical Universes (5),Science
PHY196H1 - Emergence in Nature,"The universe is not a rigid clockwork, but neither is it formless and random. Instead, it is filled with highly organized, evolved structures that have somehow emerged from simple rules of physics. Examples range from the structure of galaxies to the pattern of ripples on windblown sand, to biological and even social processes. These phenomena exist in spite of the universal tendency towards disorder. How is this possible? Self-organization challenges the usual reductionistic scientific method, and begs the question of whether we can ever really understand or predict truly complex systems. Restricted to first-year students. Not eligible for CR/NCR.","No prior experience with physical science will be required, but familiarity with Grade 10 mathematics will be assumed.",The Physical and Mathematical Universes (5),Science
PHY197H1 - Modern Physics for the Curious,"Have you wondered about the origin and workings of the natural world around us? Have you found physical science interesting but inaccessible because it was too full of math and jargon? Have you felt a pull to become more science-literate? If so, this seminar course is for you -- or for anyone interested in understanding more about the universe, including our planet, seen through the lens of modern physics. Ideas on the menu will include: particle physics, space and time, relativity, black holes, quantum physics, unification forces, string theory, and big bang cosmology. The intriguing story of these integrated phenomena unfolds over a wide distance and a long time. Students from diverse academic backgrounds are warmly welcome. Restricted to first-year students. Not eligible for CR/NCR option.","No prior experience with physical science will be required, but familiarity with Grade 10 mathematics will be assumed.",The Physical and Mathematical Universes (5),Science
PHY198H1 - Physics at the Cutting Edge,"A limited enrollment seminar course for First Year Science students interested in current research in Physics. Students will meet active researchers studying the universe from the centre of the earth to the edge of the cosmos. Topics may range from string theory to experimental biological physics, from climate change to quantum computing, from superconductivity to earthquakes. The course may involve both individual and group work, essays and oral presentations. Restricted to first-year students. Not eligible for CR/NCR option.",PHY151H1,The Physical and Mathematical Universes (5),Science
PHY199H1 - Dark Matter and Dark Energy are the New Black,"It is now 90 years since astronomers found the first evidence for a form of matter that wasn't part of the stars in our galaxies, but rather is ""dark"" and has a gravitational attraction to ordinary matter. Other lines of evidence lead us to believe that there is six times more dark matter than the ordinary matter we are familiar with. Despite this, we have no credible, direct evidence for what this dark matter might be. It is one of the biggest puzzles in particle physics and cosmology. In the last decade, we have also discovered that something else is going on – the universe appears to be filled with ""dark energy"" that causes the expansion of our universe to speed up instead of slowdown. We will discuss what we know about the hypotheses of dark matter and dark energy, and the debates about what might really be going on. Are we seeing science in crisis, with a revolution just around the corner, or is this just the ""normal science"" talked about by Kuhn and other philosophers of science? Participants will be expected to participate in seminar-style discussions, as well as take the lead on at least one topic of discussion. Restricted to first-year students. Not eligible for CR/NCR option.","No prior experience with physical science will be required, but familiarity with Grade 10 mathematics will be assumed.",The Physical and Mathematical Universes (5),Science
PHY202H1 - The Physics of Science Fiction and Gaming,"The physics of time travel, teleportation, levitation, invisibility, special effects, and other physics related topics found in literature, film, and gaming. The course will analyze the realism of physical phenomena in these media, and consider the impact of these concepts on science and society.|PHY202H1 is primarily intended as a Breadth Requirement course for students in the Humanities and Social Sciences.",,The Physical and Mathematical Universes (5),Science
PHY205H1 - The Physics of Everyday Life,An introduction to the physics of everyday life. This conceptual course looks at everyday objects to learn about the basis for our modern technological world. Topics may include anything from automobiles to weather.|PHY205H1 is primarily intended as a Breadth Requirement course for students in the Humanities and Social Sciences.,,The Physical and Mathematical Universes (5),Science
PHY207H1 - The Physics of Music,"An online course intended to provide non-science students with a basic understanding of the science behind sound and music. Topics include oscillations, waves, human hearing and perception of music, musical scales, musical instruments, recording and storing sound digitally, producing sound and broadcasting. Lectures will be delivered via the web and mandatory tutorials will require live webinar participation. The final exam will require attendance on the St. George campus.",,The Physical and Mathematical Universes (5),Science
PHY224H1 - Practical Physics I,"Develops the core practical experimental and computational skills necessary to do physics. Students tackle simple physics questions involving mathematical models, computational simulations and solutions, experimental measurements, data and uncertainty analysis.","PHY132H1/PHY152H1, (MAT135H1,MAT136H1)/MAT137Y1/MAT157Y1",The Physical and Mathematical Universes (5),Science
PHY231H1 - Physics of Living Systems,"An introductory course for students interested in understanding the physical phenomena occurring in biological systems and the applications of physics in life sciences. Topics may include physical processes inside living cells and systems, medical physics and imaging.","PHY132H1/PHY152H1,(MAT135H1,MAT136H1)/MAT137Y1/MAT157Y1",The Physical and Mathematical Universes (5),Science
PHY250H1 - Electricity and Magnetism,"An introductory course in Electromagnetism. Topics include: Point charges, Coulomb’s law, electrostatic field and potential, Gauss's Law, conductors, electrostatic energy, magnetostatics, Ampere's Law, Biot-Savart Law, the Lorentz Force Law, Faraday’s Law, Maxwell's equations in free space.","PHY132H1/PHY152H1, (MAT135H1,MAT136H1)/MAT137Y1/MAT157Y1",The Physical and Mathematical Universes (5),Science
PHY252H1 - Thermal Physics,"The quantum statistical basis of macroscopic systems; definition of entropy in terms of the number of accessible states of a many particle system leading to simple expressions for absolute temperature, the canonical distribution, and the laws of thermodynamics. Specific effects of quantum statistics at high densities and low temperatures.","PHY132H1/PHY152H1, (MAT135H1,MAT136H1)/MAT137Y1/MAT157Y1",The Physical and Mathematical Universes (5),Science
PHY254H1 - Classical Mechanics,"The course analyzes the linear, nonlinear and chaotic behaviour of classical mechanical systems such as harmonic oscillators, rotating bodies, and central field systems. The course will develop the analytical and numerical tools to solve such systems and determine their basic properties. The course will include mathematical analysis, numerical exercises using Python, and participatory demonstrations of mechanical systems.","PHY132H1/PHY152H1 (PHY152H1 recommended), (MAT135H1, MAT136H1)/MAT137Y1/MAT157Y1",The Physical and Mathematical Universes (5),Science
PHY256H1 - Introduction to Quantum Physics,Failures of classical physics; the Quantum revolution; Stern-Gerlach effect; harmonic oscillator; uncertainty principle; interference packets; scattering and tunneling in one-dimension.,"PHY132H1/PHY152H1, (MAT135H1,MAT136H1)/MAT137Y1/MAT157Y1",The Physical and Mathematical Universes (5),Science
PHY299Y1 - Research Opportunity Program,Credit course for supervised participation in faculty research project. Details at https://www.artsci.utoronto.ca/current/academics/research-opportunities/research-opportunities-program. Not eligible for CR/NCR option.,,,Science
PHY324H1 - Practical Physics II,"A modular practical course that further develops the core experimental and computational skills necessary to do physics. Modules include: experimental skills building, computational tools in data and uncertainty analysis, and independent experimental projects.",PHY224H1,The Physical and Mathematical Universes (5),Science
PHY331H1 - Introduction to Biological Physics,"A course for students interested in a deeper understanding of physical phenomena occurring in biological systems. Thermodynamics, diffusion, entropic forces, fluids, biological applications.","PHY252H1/CHM222H1/CHM225Y1, PHY231H1/PHY250H1/PHY254H1/PHY256H1",The Physical and Mathematical Universes (5),Science
PHY350H1 - Electromagnetic Theory,"This course builds upon the knowledge and tools developed in PHY250H1. Topics include: solving Poisson and Laplace equations via method of images and separation of variables, multipole expansion for electrostatics, atomic dipoles and polarizability, polarization in dielectrics, multipole expansion in magnetostatics, magnetic dipoles, magnetization in matter, Maxwell’s equations in matter, conservation laws in electrodynamics, and electromagnetic waves.","MAT223H1/MAT240H1, MAT244H1/MAT267H1, MAT235Y1/MAT237Y1/MAT257Y1, PHY250H1, PHY254H1",The Physical and Mathematical Universes (5),Science
PHY354H1 - Advanced Classical Mechanics,"Symmetry and conservation laws, stability and instability, generalized coordinates, Hamilton's principle, Hamilton's equations, phase space, Liouville's theorem, canonical transformations, Poisson brackets, Noether's theorem.","MAT244H1/MAT267H1, PHY254H1",The Physical and Mathematical Universes (5),Science
PHY356H1 - Quantum Mechanics I,The general structure of wave mechanics; eigenfunctions and eigenvalues; operators; orbital angular momentum; spherical harmonics; central potential; separation of variables; hydrogen atom; Dirac notation; operator methods; harmonic oscillator and spin.,"MAT223H1/MAT240H1, PHY250H1, PHY256H1/(CHM222H1,CHM223H1)/CHM225Y1, (PHY256H1 recommended)",The Physical and Mathematical Universes (5),Science
PHY357H1 - Nuclear and Particle Physics,"The subatomic particles; nuclei, baryons and mesons, quarks, leptons and bosons; the structure of nuclei and hadronic matter; symmetries and conservation laws; fundamental forces and interactions, electromagnetic, weak, and strong; a selection of other topics: CP violation, nuclear models, standard model, proton decay, supergravity, nuclear and particle astrophysics. This course is not a prerequisite for any PHY400-level course.",PHY356H1,The Physical and Mathematical Universes (5),Science
"PHY358H1 - Atoms, Molecules and Solids","Quantum theory of atoms, molecules, and solids; variational principle and perturbation theory; hydrogen and helium atoms; exchange and correlation energies; multielectron atoms; simple molecules; bonding and antibonding orbitals; rotation and vibration of molecules; crystal binding; electron in a periodic potential; reciprocal lattice; Bloch's theorem; nearly-free electron model; Kronig-Penney model; energy bands; metals, semiconductors, and insulators; Fermi surfaces.",PHY356H1,The Physical and Mathematical Universes (5),Science
PHY365H1 - Quantum Information,"Introduction to quantum computing and other quantum information topics; Quantum states of multi-particle systems; Entanglement, Bell inequalities and Teleportation; Quantum Key Distribution; Quantum Computing Algorithms; Quantum Information Processing Technologies; other applications to metrology and illumination.",PHY256H1/PHY294H1/CHM223H1/ECE330H1 (Students who do not meet these prerequisites are encouraged to contact the Department.),The Physical and Mathematical Universes (5),Science
PHY371Y1 - Supervised Study in Physics,"An individual study program chosen by the student with the advice of, and under the direction of, a staff member. A student may take advantage of this course either to specialize further in a field of interest or to explore interdisciplinary fields not available in the regular syllabus. Consult the department web pages for some possible topics. This course may also be available in the summer. Not eligible for CR/NCR option.",Consult the Physics Associate Chair (Undergraduate Studies),The Physical and Mathematical Universes (5),Science
PHY372H1 - Supervised Study in Physics,"An individual study program chosen by the student with the advice of, and under the direction of, a staff member. A student may take advantage of this course either to specialize further in a field of interest or to explore interdisciplinary fields not available in the regular syllabus. Consult the department web site for some possible topics. This course may also be available in the summer. Not eligible for CR/NCR option.",Consult the Physics Associate Chair (Undergraduate Studies),The Physical and Mathematical Universes (5),Science
PHY385H1 - Introductory Optics,"An introduction to the physics of light. Topics covered include: electromagnetic waves and propagation of light; the Huygens and Fermat principles; geometrical optics and optical instruments; interference of waves and diffraction; polarization; introduction to photons, lasers, and optical fibers.","PHY250H1, PHY254H1",The Physical and Mathematical Universes (5),Science
PHY392H1 - Physics of Climate,This course provides an introduction to climate physics and the earth-atmosphere-ocean system. Topics include solar and terrestrial radiation; global energy balance; radiation laws; radiative transfer; atmospheric structure; convection; the meridional structure of the atmosphere; the general circulation of the atmosphere; the ocean and its circulation; and climate variability.,"PHY250H1/PHY252H1, MAT235Y1/MAT237Y1/MAT257Y1",The Physical and Mathematical Universes (5),Science
PHY396Y0 - Research Topic Abroad,Course credit for research or field studies abroad under the supervision of a faculty member. Not eligible for CR/NCR option.,A minimum of 8.5 credits and no more than 14.0 credits completed,The Physical and Mathematical Universes (5),Science
PHY397Y0 - Exchange Research Project Abroad,Course credit for research or field studies abroad under the supervision of a faculty or staff member from an exchange institution. Consult the Physics Department web pages for information about opportunities. Not eligible for CR/NCR option.,Consult the Physics Associate Chair (Undergraduate Studies),The Physical and Mathematical Universes (5),Science
PHY398H0 - Research Excursions,An instructor-supervised group project in an off-campus setting. Details at https://www.artsci.utoronto.ca/current/academics/research-opportunities/research-excursions-program. Not eligible for CR/NCR option.,,,Science
PHY398Y0 - Research Excursions,An instructor-supervised group project in an off-campus setting. Details at https://www.artsci.utoronto.ca/current/academics/research-opportunities/research-excursions-program. Not eligible for CR/NCR option.,,,Science
PHY399Y1 - Research Opportunity Program,Credit course for supervised participation in faculty research project. Details at https://www.artsci.utoronto.ca/current/academics/research-opportunities/research-opportunities-program. Not eligible for CR/NCR option.,,,
PHY405H1 - Electronics Lab,"Electrical circuits, networks and devices are all-pervasive in the modern world. This laboratory course is an introduction to the world of electronics. Students will learn the joys and perils of electronics, by designing, constructing and debugging circuits and devices. The course will cover topics ranging from filters and operational amplifiers to micro-controllers, and will introduce students to concepts such as impedance, transfer functions, feedback and noise.","PHY224H1, PHY250H1. Note that PHY405H1 may be taken in third or fourth year.",The Physical and Mathematical Universes (5),Science
PHY407H1 - Computational Physics,"This is an introduction to scientific computing in physics. Students will be introduced to computational techniques used in a range of physics research areas. By considering select physics topics, students will learn basic computational methods for function analysis (computing integrals and derivatives; finding roots and extrema), resolution of linear and non-linear equations, eigenvalue problems, Fourier analysis, ODEs, PDEs and Monte Carlo techniques. As the course progresses, students will develop their skills at debugging, solution visualization, computational efficiency and accuracy. The course is based on python and will involve working on a set of computational labs throughout the semester as well as a final project.",PHY224H1/PHY254H1,The Physical and Mathematical Universes (5),Science
PHY408H1 - Time Series Analysis,"The analysis of digital sequences; filters; the Fourier Transform; windows; truncation effects; aliasing; auto and cross-correlation; stochastic processes, power spectra; least squares filtering; application to real data series and experimental design.",PHY407H1/PHY224H1/PHY250H1/PHY254H1/PHY324H1. PHY408H1 may be taken in third or fourth year,The Physical and Mathematical Universes (5),Science
PHY424H1 - Advanced Physics Laboratory,"Experiments in this course are designed to form a bridge to current experimental research. A wide range of exciting experiments relevant to modern research in physics is available. The laboratory is normally open from 9 a.m. - 4 p.m., Monday to Friday.","PHY250H1, PHY256H1, PHY324H1",The Physical and Mathematical Universes (5),Science
PHY426H1 - Advanced Practical Physics I,"This course is a continuation of PHY424H1, but students have more freedom to progressively focus on specific areas of physics, do extended experiments, projects, or computational modules.",PHY424H1,The Physical and Mathematical Universes (5),Science
PHY428H1 - Advanced Practical Physics II,"This course is a continuation of PHY426H1, but students have more freedom to progressively focus on specific areas of physics, do extended experiments, projects, or computational modules.",PHY426H1,The Physical and Mathematical Universes (5),Science
PHY429H1 - Advanced Practical Physics III,"This course is a continuation of PHY428H1, but students have more freedom to progressively focus on specific areas of physics, do extended experiments, projects, or computational modules.",PHY428H1,The Physical and Mathematical Universes (5),Science
